	subject	target_sentence	db_cond	response	threshold
236	pilot6	Opa jammert ständig über seine Asthmaanfälle	-2.0	 Opa jammert ständig.	sentences
237	pilot6	Vor der Hütte sitzt ein großer Heuhaufen	0.0	 Vor der Hütte sitzt ein großer Heuhaufen.	sentences
238	pilot6	Das amtliche Amtsblatt liegt überm Durchschnitt	-1.0	 nicht verstanden.	sentences
0	pilot7	In der Dämmerung kommen wir heim.	10.0	 In der Dämmerung kommen wir heim.	sentences
1	pilot7	Die Tante bewohnt ein nettes Häuschen	10.0	 Die Tante bewohnt ein nettes Häuschen.	sentences
2	pilot7	Danach tut eine Wanderung gut.	2.0	 Nicht verstanden.	sentences
3	pilot7	Ein freundliches Lächeln erhellt den Tag.	10.0	 Ein freundliches Lächeln erhellt den Tag.	sentences
4	pilot7	Nach dem Aufräumen fand ich mein Buch.	-1.0	 die Straße	sentences
5	pilot7	Die Familie genießt gemeinsames Abendessen.	2.0	 Die Familie genießt das gemeinsame Abendessen.	sentences
6	pilot7	Durch den ständigen Föhn verdorren die Ähren.	0.0	 Nicht verstanden.	sentences
7	pilot7	Die Straßenlaterne spendet warmes Licht.	2.0	 Die Straßenlaterne spendet warmes Licht.	sentences
8	pilot7	Der Kellner jongliert mit den Speisekarten.	1.0	 Der Kellner jongliert mit der Speisekarte.	sentences
9	pilot7	Die Blumen blühen bunt im Blumenkasten.	1.0	 Blumennest.	sentences
10	pilot7	Die Zeit versteckt sich im Echo.	0.0	 Die Zeit versteckt sich.	sentences
11	pilot7	Die Hilfsmannschaft setzt sich in Marsch.	2.0	 Die Mannschaft setzt sich in Marsch.	sentences
12	pilot7	Die Tür knarrt beim Öffnen mysteriös.	2.0	 Die Tür knarrt beim Öffnen.	sentences
13	pilot7	Die Uhr tickt im Rhythmus der Stille.	-2.0	 die Uhr tickt im Rhythmus der	sentences
14	pilot7	Der Fernseher zeigt die Nachrichten.	-1.0	 im Januar	sentences
15	pilot7	Das Fahrrad rollt leise über Kopfsteinpflaster.	-1.0	 Das Fahrrad rollt leise über Kopfsteinpflaster.	sentences
16	pilot7	Über die Felder weht ein Wind	-2.0	 Die Tür.	sentences
17	pilot7	Schnaps im Tee verfälscht das Aroma.	0.0	tee das Aroma.	sentences
18	pilot7	Die Uhr tickt ruhig an der Wand.	-1.0	 Die Uhr tickt.	sentences
19	pilot7	Der Spiegel reflektiert vergessene Gesichter.	0.0	 der Spiegel einzelne Gesichter.	sentences
20	pilot7	Prinzipiell müssen alle Hunde ein Halsband tragen.	-2.0	 prinzipiell.	sentences
21	pilot7	Böse Menschen verdienen ihre Strafe.	-2.0	 Nicht verstanden.	sentences
22	pilot7	Autos fahren auf der Straße.	2.0	 Autos fahren auf der Straße.	sentences
23	pilot7	Die Vögel zwitschern am Morgen.	2.0	 Die Vögel zwitschern am Morgen.	sentences
24	pilot7	Adler fliegen tausend Meter hoch.	1.0	 Die Adler fliegen hoch.	sentences
25	pilot7	Opa jammert ständig über seine Asthmaanfälle.	0.0	 ständig.	sentences
26	pilot7	Schulkinder müssen Rechnen und Schreiben lernen.	-1.0	 Schüler müssen rechnen und schreiben lernen.	sentences
27	pilot7	Der Kamin verbreitet wohlige Wärme.	0.0	 der Termin.	sentences
28	pilot7	Junge Erwachsene genießen das Stadtfest.	1.0	 Junge Erwachsene genießen das Stadtfest.	sentences
29	pilot7	Der Regen prasselt auf das Dachfenster.	-2.0	 Der Regen prasselt auf das Dachfenster.	sentences
30	pilot7	Es wird auch da chinesisch gesprochen.	2.0	 Es wird klar.	sentences
31	pilot7	Auf dem Gehweg quietschen Kinderfahrräder.	10.0	 Auf dem Gehweg quietschen Kinderfahrräder.	sentences
32	pilot7	Das Café ist Treffpunkt für Gespräche.	1.0	 Das Café ist Treffpunkt für Gespräche.	sentences
33	pilot7	Sie hat die Neuigkeit mit Genugtuung aufgenommen.	10.0	 Sie hat die Neuigkeit mit Genugtuung aufgenommen.	sentences
34	pilot7	Der Frosch sprang rein ins Täschchen.	0.0	 Der Frosch sprang weit.	sentences
35	pilot7	Leise rollen wir aus dem Bahnhof.	-1.0	 nicht verstanden.	sentences
36	pilot7	Ein leiser Windhauch streift die Wiesen.	1.0	 Ein leiser Wind haucht durch die See.	sentences
37	pilot7	Diese Mannschaft schoss gleich drei Tore.	-1.0	 Diese Landschaft.	sentences
38	pilot7	Die letztmalige Feststellung war eindrucksvoll.	10.0	 Die letztmalige Feststellung war eindrucksvoll.	sentences
39	pilot7	Der Hund las heimlich die Zeitung.	0.0	 Der Hund war...	sentences
40	pilot7	Ein Bauer arbeitet auf seinem Acker.	2.0	 Der Bauer arbeitet auf seinem Acker.	sentences
41	pilot7	Die Zeit flüstert Geheimnisse zu.	2.0	 Die Zeit flüstert	sentences
42	pilot7	Die Vögel umkreisten den Turm.	0.0	 Die Vögel umkreisten den Turm.	sentences
43	pilot7	Für Volkskunst schwärmt nicht jede Altersstufe.	0.0	 alten Züge.	sentences
44	pilot7	Kollegen feiern den Abschluss eines erfolgreichen Projekts.	10.0	 Der Regen feiert den Abschluss eines erfolgreichen Projekts.	sentences
45	pilot7	Stehend macht man seine Aussage.	-1.0	 an seinem Rucksack.	sentences
46	pilot7	Die Tomate im Kühlschrank keimte.	1.0	 Nicht verstanden.	sentences
47	pilot7	Gleich hier sind die Nahrungsmittel	1.0	 nicht verstanden.	sentences
48	pilot7	Die Sonne strahlt am wolkenlosen Himmel.	-2.0	 Die Sonne stand am wolkenlosen Himmel.	sentences
49	pilot7	Der Fernseher spielt eigenwillige Liebesfilme.	10.0	 Der Fernseher guckt eigenwillige Liebesfilme.	sentences
50	pilot7	Nach einer Umfrage kennt niemand dieses Fremdwort.	-2.0	 nach einer Umfrage	sentences
51	pilot7	Alle eilen gleich links ins Freie.	0.0	 Nicht verstanden.	sentences
52	pilot7	Im Geschäft stehen viele Leute	10.0	 Im Geschäft stehen viele Leute.	sentences
53	pilot7	Sie läuft entspannt am Strand entlang.	-2.0	 nicht verstanden.	sentences
54	pilot7	Die Musik erklingt sanft im Raum.	10.0	 Die Musik erklingt sanft im Raum.	sentences
55	pilot7	Nervöse Menschen brauchen viel Ruhe.	-1.0	 Der große Mensch braucht seine Ruhe.	sentences
56	pilot7	Senioren machen morgendliche Gymnastik im Park.	0.0	Im Murren machen	sentences
57	pilot7	Schnupfen stört uns natürlich sehr.	1.0	 Schnupfen stört uns.	sentences
58	pilot7	Ein Stückchen weiter nördlich ist eine Umgehungsstraße.	0.0	 Ein bisschen Mensch.	sentences
59	pilot7	Er gewinnt sechs Spiele nacheinander.	-1.0	 die Festspiele	sentences
60	pilot7	Vater mischt gleich die Karten.	10.0	 Vater mischt gleich die Karten.	sentences
61	pilot7	Frische Gardinen hängen am Fenster.	1.0	 Frische Gardinen hängen am Fenster.	sentences
62	pilot7	Die Blumen blühen im Garten.	2.0	 Die Blumen blühen im Garten.	sentences
63	pilot7	Der Löwe schleicht im Käfig umher.	2.0	 Der Löwe schreit im Käfig herum.	sentences
64	pilot7	Die Sonne scheint am blauen Himmel.	-2.0	 Die Sonne scheint am blauen Himmel.	sentences
65	pilot7	Ein ruhiger Bach plätschert durch den Wald.	2.0	 Der ruhige Bach plätschert durch den Wald.	sentences
66	pilot7	Der Wecker klingelt zur gewohnten Zeit.	1.0	 Der Wecker, die Zeit.	sentences
67	pilot7	Der Kieselstein träumt von fernen Ufern.	-1.0	 Der trübe Stein vom Fernen.	sentences
68	pilot7	Sechs Mädchen wollen Schwester werden.	0.0	 Nicht verstanden.	sentences
69	pilot7	Die Stille singt in fernen Sprachen.	1.0	 Nicht verstanden.	sentences
70	pilot7	Wir hören den Plätschernden Bach	10.0	 Wir hören den plätschernden Bach.	sentences
71	pilot7	Seine Worte schwebten wie Schmetterlinge.	0.0	 Seine Worte schwebten	sentences
72	pilot7	Das Echo trägt Gedichte fort.	-1.0	 das Echo.	sentences
73	pilot7	Der Schatten webt stille Geschichten.	-1.0	 Geschichten.	sentences
74	pilot7	Das Buch liegt auf dem gemütlichen Sofa.	0.0	 Das Buch liegt auf dem gemütlichen Sofa.	sentences
75	pilot7	Unruhig tanzen Blätter im Sonnenschein.	1.0	 Nicht verstanden.	sentences
76	pilot7	Sein Blick streifte die Sterne.	1.0	 Sternen.	sentences
77	pilot7	Mein Chef hat eine seltsame Frisur.	-2.0	 Ein Schiff hat eine seltsame Figur.	sentences
78	pilot7	Du bewirbst dich bei der gepflegten Wirtschaftsbank.	2.0	 gepflegten Wirtschaftsplan.	sentences
79	pilot7	Verwirrte Schatten tanzen auf Wegen.	-2.0	 Schatten tanzen im Licht.	sentences
80	pilot7	Der Bahnhof liegt sieben Minuten entfernt.	-1.0	 Nicht verstanden.	sentences
81	pilot7	Draußen fliegt die Landschaft vorbei.	2.0	 Im Draußen fliegt die Landschaft vorbei.	sentences
82	pilot7	Zum Ausweis gehört ein Lichtbild.	0.0	 Draußen.	sentences
83	pilot7	Der Polizist spielt Gitarre für die Nachbarschaft.	-1.0	 im Fluss fliegt.	sentences
84	pilot7	Der Arzt untersucht den Patienten.	10.0	 Der Arzt untersucht den Patienten.	sentences
85	pilot7	Ängstlich begreifst du Omas Lage.	0.0	 Nicht verstanden.	sentences
86	pilot7	Mein Arzt empfahl dringend Bäder.	10.0	 Mein Arzt bringen Bäder.	sentences
87	pilot7	Die Ärzte sind damit gar nicht einverstanden.	2.0	 Die Ärzte sind...	sentences
88	pilot7	Die Freunde teilen Geschichten am Lagerfeuer.	2.0	 Geschichten im Feuer.	sentences
89	pilot7	Der Kaffee dampft in den Tassen.	-1.0	 Der Kaffee dampft in den Tassen.	sentences
90	pilot7	Durch Wald und Feld führt unser Weg.	1.0	 Der Wald enthält	sentences
91	pilot7	Die Bremse quietscht beim linkslastigen Bremsen.	2.0	 pflanzen.	sentences
92	pilot7	Diese zarten Blumen welken rasch.	10.0	 Diese zarten Blumen welken rasch.	sentences
93	pilot7	Ein primitiver Mensch wird keine Scheu kennen.	10.0	 Ein primitiver Mensch wird	sentences
94	pilot7	Auch der Elefant ist ein Geschöpf Gottes.	10.0	 Auch der Elefant ist ein Geschöpf Gottes.	sentences
95	pilot7	Diese Durchsage ist ohne Gewähr.	10.0	 Diese Durchsage ist ohne Gewähr.	sentences
96	pilot7	Messer und Gabel liegen neben dem Teller.	1.0	 Messer und Gabel liegen auf dem Teller.	sentences
97	pilot7	Die Kaffeetasse klirrt beim Frühstück.	-2.0	 die Kaffeetasse,	sentences
98	pilot7	Die Straßenmusiker unterhalten Passanten mit ihrer Musik.	-1.0	 Die Musiker unterhalten Musik.	sentences
99	pilot7	Der Kaffeeplausch wurde von Ameisen gestört.	-2.0	 Der Frühstücksplausch.	sentences
100	pilot7	Ein Lächeln erhellt das Gesicht.	10.0	 Ein Lächeln erhellt das Gesicht.	sentences
101	pilot7	Am blauen Himmel ziehen die Wolken	2.0	 Am blauen Himmel ziehen die Wolken.	sentences
102	pilot7	Die Krankenschwester jongliert mit Medikamenten.	-2.0	 Die Krankenschwester hilft den Menschen.	sentences
103	pilot7	Bei Konkurs kennt der Richter keine Gnade.	10.0	 Beim Konkurs kennt der Richter keine Gnade.	sentences
104	pilot7	Die Sterne funkeln am Nachthimmel.	2.0	 Die Sterne funkeln am Nachthimmel.	sentences
105	pilot7	Der Regen tropft vom Dach.	10.0	 Der Regen tropft vom Dach.	sentences
106	pilot7	Bei dem Peitschenknall scheuten die Rösser.	-2.0	 schwommen.	sentences
107	pilot7	Sie liest ein Buch in der Sonne.	1.0	 Sie liest ein Buch in der Sonne.	sentences
108	pilot7	Die weiße Leinwand wird vom Maler beschriftet.	2.0	 Maler.	sentences
109	pilot7	Die Kaffeetasse dampft auf dem Frühstückstisch.	10.0	 Die Kaffeetasse dampft auf dem Frühstückstisch.	sentences
110	pilot7	Der Regen spielt Klavier auf Dächern.	10.0	 Der Regen spielt Klavier auf den Dächern.	sentences
111	pilot7	Der Kühlschrank summt seltsame Melodien.	-1.0	 Der Kühlschrank.	sentences
112	pilot7	Geld allein macht nicht glücklich.	2.0	 Geld allein macht nicht glücklich.	sentences
113	pilot7	Die Kartoffeln gehören zum Mittagessen	1.0	 zum Mittagessen.	sentences
114	pilot7	Der Raureif zaubert Diamanten auf Blätter.	10.0	 Der Rauhreif zaubert Diamanten auf Blätter.	sentences
115	pilot7	Er hat eine sprunghafte Gangart.	1.0	 Nicht verstanden.	sentences
116	pilot7	Der Donner murmelt geheime Botschaften.	1.0	 Der Donner murmelt eine Botschaft zusammen.	sentences
117	pilot7	Ein Paar tanzt unter dem Sternenhimmel.	2.0	 Ein Paar tanzte.	sentences
118	pilot7	Auf dem Dach singt fröhlich ein Vogel.	2.0	 Auf dem Dach ein Vogel.	sentences
119	pilot7	In der Galerie bewundern Besucher zeitgenössische Kunst.	-1.0	 Nicht verstanden.	sentences
120	pilot7	Einstweilen ist Erfolg die Hauptsache.	10.0	 Einstweilen ist Erfolg die Hauptsache.	sentences
121	pilot7	Der Pflug zieht tiefe Furchen.	10.0	 Der Pflug zieht tiefe Furchen.	sentences
122	pilot7	Durch den Regen leuchtet das Feuer.	0.0	 Durch den Regen leuchtet das Feuer.	sentences
123	pilot7	Das Wasser kocht auf dem Herd.	-2.0	 Das Wasser kocht auf der Herdplatte.	sentences
124	pilot7	Der Apfelbaum trägt viele reife Äpfel.	-1.0	 Der Apfelbaum trägt reife Früchte.	sentences
125	pilot7	Die Katze schläft auf dem Sofa	-1.0	 Nicht verstanden.	sentences
126	pilot7	Die Straßenlaternen leuchten im Abendnebel.	10.0	 Die Straßenlaternen leuchten im Abendnebel.	sentences
127	pilot7	Ein Schiff gleitet über das Wasser.	2.0	 Ein Schiff gleitet über das Wasser.	sentences
128	pilot7	Montag war es uns zu regnerisch.	-1.0	 Der Montag war ganz regnerisch.	sentences
129	pilot7	Die Wolken malen Geschichten am Himmel.	0.0	 Die Wolken malen Geschichten.	sentences
130	pilot7	Das Licht tanzte über dem Fluss.	0.0	 nicht verstanden.	sentences
131	pilot7	Der Nachbar trägt heute einen bunten Anzug.	-1.0	 Nicht verstanden.	sentences
132	pilot7	Das amtliche Amtsblatt liegt überm Durchschnitt.	-1.0	 Nicht verstanden.	sentences
133	pilot7	Der Widerspruch malt abstrakte Gedankenbilder.	-1.0	 Der Wind malt abstrakte 	sentences
134	pilot7	Der Mondschein taucht die Landschaft in Silber.	2.0	 Der Mondschein taucht die Landschaft in Silber.	sentences
135	pilot7	Die Nachbarn feiern gemeinsam im Garten.	-2.0	 Die Nachbarn feiern im Garten eine Party.	sentences
136	pilot7	Das war jetzt aber ein schöner Tag.	2.0	 Das war jetzt aber ein schöner Tag.	sentences
137	pilot7	Der Termin des Treffpunkts wird noch abgesprochen	10.0	 Der Termin des Treffpunktes wird noch abgesprochen.	sentences
138	pilot7	Der Hund bellt vor dem Haus.	0.0	 Der Hund bellt raus.	sentences
139	pilot7	Wenn der Schnee schmilzt, kommt der Frühling.	-1.0	 Der Schnee schmilzt.	sentences
140	pilot7	Unserer Tante fehlt gar nichts.	1.0	 unsere tante	sentences
141	pilot7	Studenten treffen sich in der Bibliothek.	1.0	 Die Studenten treffen sich	sentences
142	pilot7	Sein Singen erfüllte den stillen Wald.	-2.0	 die im stillen Wald	sentences
143	pilot7	Die Straßen sind voller fröhlicher Passanten.	1.0	 Die Straßen folgen	sentences
144	pilot7	Ihr Lachen hallte durch den leeren Park.	0.0	 die Nacht ihren	sentences
145	pilot7	Die Gärtnerin tanzt zwischen den Blumenbeeten.	0.0	 Er tanzt zwischen den Blumenbeeten.	sentences
146	pilot7	Einige Busse fahren heute später.	1.0	 Die kleinen Busse fahren.	sentences
147	pilot7	Die Friseurin malt kleine Kunstwerke in Haare.	10.0	 Die Friseurin malt kleine Kunstwerke in Haare.	sentences
148	pilot7	Wild pfeift der Wind durch die Wände.	-1.0	 Wind durch die Täler.	sentences
149	pilot7	Der Kaffee duftet sehr verlockend.	10.0	 Der Kaffee duftet sehr verlockend.	sentences
150	pilot7	Die Entscheidung darfst du selbst fällen.	-2.0	 Die Zeitung.	sentences
151	pilot7	Sie hört Musik mit geschlossenen Augen.	0.0	 Sie hört Musik mit geschlossenen Decken.	sentences
152	pilot7	Der Staubsauger entdeckte verlorene Ohrringe.	-2.0	 Nicht verstanden.	sentences
153	pilot7	Der Bus fährt durch die Stadt.	0.0	 Der Bus fährt durch die Stadt.	sentences
154	pilot7	Heute jeder Strauß Blumen zwei Mark.	-1.0	 Die Spieler Kalmar.	sentences
155	pilot7	Die Träume tanzen auf Wolken.	-2.0	 Nicht verstanden.	sentences
156	pilot7	Wir wollen heute spazieren gehen.	0.0	 Nicht verstanden.	sentences
157	pilot7	Das Telefon klingelt in der stillen Wohnung.	-1.0	 Das Telefon klingelt in der stillen Wohnung.	sentences
158	pilot7	Im Dschungel herrscht skrupellose Lebensform.	2.0	 Der Dschungel.	sentences
159	pilot7	Öfen brauchen Kohlen und Briketts.	1.0	 Tauben.	sentences
160	pilot7	Seine Frau macht ein trauriges Gesicht.	0.0	 Eine Frau macht ein trauriges Gesicht.	sentences
161	pilot7	Motoren brauchen Benzin, Öl und Wasser.	1.0	 Wasser.	sentences
162	pilot7	Der Regen klopft ans Fenster.	-2.0	 Der Regen tropft durchs Fenster.	sentences
163	pilot7	Hier richten Zimmerleute ein Dach.	-2.0	 Leute.	sentences
164	pilot7	Ein Künstler malt Porträts auf dem Marktplatz.	-2.0	 Ein Künstler malt Porträts.	sentences
165	pilot7	Du hilfst mir beim Fernstudium.	10.0	 Du hilfst mir beim Fernstudium.	sentences
166	pilot7	Der Regenschirm schützt vor plötzlichem Regen.	-2.0	 Der Regenschirm schützt vor plötzlichem Regen.	sentences
167	pilot7	Die Hochzeit versammelt Familie und Freunde.	1.0	 Die Hochzeit wird mit Familie und Freunden.	sentences
168	pilot7	Verkehrsampeln leuchten grün, gelb, rot.	-2.0	 grün und gelb.	sentences
169	pilot7	Manche Menschen vertragen keine Erdbeeren.	0.0	 Nicht verstanden.	sentences
170	pilot7	Die Katze schnurrt zufrieden auf dem Sofa.	-2.0	 Die Katze schubst.	sentences
171	pilot7	Vor der Hütte sitzt ein großer Heuhaufen.	2.0	 Großer Heuhaufen.	sentences
172	pilot7	Sie trägt ein Lächeln im Gesicht.	10.0	 Sie trägt ein Lächeln im Gesicht.	sentences
173	pilot7	Die Stille malt lebendige Bilder.	-2.0	 Die Stille macht...	sentences
174	pilot7	Der Spiegel reflektiert verlorene Gedanken.	0.0	 Nicht verstanden.	sentences
175	pilot7	Unser Doktor besucht Vater täglich.	-2.0	 Nicht verstanden.	sentences
176	pilot7	Beim Studienkurs musst Du ernsthaft lernen.	1.0	 Der Studienbus.	sentences
177	pilot7	Der Postbote liest Gedichte beim Zustellen.	-1.0	 die Post zuständig.	sentences
178	pilot7	Morgen wird es neblig und eiskalt.	10.0	 Im Morgen wird es neblig und eiskalt.	sentences
179	pilot7	Diese Gegend nennt man Sandwüste.	-2.0	 Zahnbürste.	sentences
180	pilot7	Die Sehnsucht fliegt auf Papierfliegern.	-2.0	 Nicht verstanden.	sentences
181	pilot7	Der alte Baum erzählte vom Leben.	-2.0	 Regen.	sentences
182	pilot7	In den Bergen kann man Ski laufen.	1.0	 In den Bergen kann man Ski fahren.	sentences
183	pilot7	Englische Kriminalromane sind ihm die liebste Lektüre.	0.0	 Romane.	sentences
184	pilot7	Die Treppe führt ins kuschelige Schlafzimmer.	-1.0	 Die Treppe führt zur Straße.	sentences
185	pilot7	Nach diesen Sturmböen herrscht ein furchtbares Chaos.	0.0	 herrscht ein furchtbares Chaos.	sentences
186	pilot7	Die Melodie schmeckt nach Sommer.	1.0	 Zimmer.	sentences
187	pilot7	Der Lehrer erklärt schwierige Konzepte.	-1.0	 Der Lehrer erklärt schwierige	sentences
188	pilot7	Sein Blick fiel auf den Boden.	-2.0	 nicht verstanden.	sentences
189	pilot7	Nach der harten Arbeit brauche ich Zerstreuung.	0.0	 nach der harten Arbeit	sentences
190	pilot7	Der Regenbogen endete im Blumentopf.	-2.0	 der Regenbogen	sentences
191	pilot7	Der Laptop surft schnell im Internet.	2.0	 Der Laptop surft schnell im Internet.	sentences
192	pilot7	Im Park traf ich meinen Deutschlehrer.	2.0	 nicht verstanden.	sentences
193	pilot7	Ein Musiker verzaubert die Menschenmenge.	1.0	 Der Musiker zaubert.	sentences
194	pilot7	Vater will sich eine Pfeife anzünden	-1.0	 Der Vater löst...	sentences
195	pilot7	Die Melodie malt leuchtende Träume.	-2.0	 Leuchten Träume	sentences
196	pilot7	Der Bus hupt vor der belebten Haltestelle.	2.0	 Der Bus vor der belebten Haltestelle.	sentences
197	pilot7	Am Samstag öffnet der Kiosk erstmals.	-1.0	 Am Samstag öffnet der Kiosk erst.	sentences
198	pilot7	Achtlos wirft der Knirps Matsch durchs Eckfenster.	10.0	 Achtlos wirft der Knirps Matsch durch das Heckfenster.	sentences
199	pilot7	Jeden Freitag gibt's frischen Fisch.	0.0	 Jeden Freitag.	sentences
200	pilot7	Im Wald plätschert eine dunkle Quelle.	1.0	 Im Wald plätschert eine dunkle Quelle.	sentences
201	pilot7	Unsere beiden Hunde haben Durst.	2.0	 Nicht verstanden.	sentences
202	pilot7	Wir haben ein Abteil extra für uns.	1.0	 nicht verstanden.	sentences
203	pilot7	Der Kaffee duftet verführerisch am Morgen.	1.0	 Der Kaffee duftet verführerisch am Morgen.	sentences
204	pilot7	Ein älteres Ehepaar tanzt auf der Hochzeitsfeier.	2.0	 Ein älteres Ehepaar tanzt	sentences
205	pilot7	Die Blumen blühen im Winter schwarz.	1.0	 Die Blumen blühen im Schwarz.	sentences
206	pilot7	Flüsternd erzählt der Wind Geschichten.	1.0	 Der erzählt Geschichten.	sentences
207	pilot7	Der Nachbar sang unter der Dusche Oper.	0.0	 Dusche, Opa.	sentences
208	pilot7	Auf dem Brett leuchten bunte Tulpen.	1.0	 Auf dem Brett leuchten bunte Tulpen.	sentences
209	pilot7	Ein älteres Paar spaziert hand in Hand.	10.0	 Ein älteres Paar spaziert Hand in Hand.	sentences
210	pilot7	Die Bäckerin singt fröhlich beim Brötchenbacken.	-2.0	 nicht verstanden.	sentences
211	pilot7	Die Lampe spendet angenehmes, helles Licht.	-2.0	 Nicht verstanden.	sentences
212	pilot7	Die Radfahrer erkunden den Wald.	-2.0	 Der...	sentences
213	pilot7	Löst doch die Fahrkarten am Schalter!	10.0	 Löst doch die Fahrkarten am Schalter.	sentences
214	pilot7	Der Nachbar trägt immer Hüte.	2.0	 Der Nachbar trägt immer Schlüssel.	sentences
215	pilot7	Das kalte Licht leuchtet am Morgen.	1.0	 Nicht verstanden.	sentences
216	pilot7	Unsere Söhne lieben flotte Tänze.	10.0	 Unsere Söhne lieben flotte Tänze.	sentences
217	pilot7	Die Blumen blühen im sonnigen Garten.	0.0	 Die Blumen blühen im sonnigen Garten.	sentences
218	pilot7	Morgen umarmt der Nebel die Berge.	10.0	 Im Morgen umarmt der Nebel die Berge.	sentences
219	pilot7	Fünf Filmtitel müssen wir aufschreiben.	-1.0	 Film.	sentences
220	pilot7	Die Freunde treffen sich am See.	1.0	 nicht verstanden.	sentences
221	pilot7	Ein bunter Schmetterling tanzt im Sonnenlicht.	2.0	 Ein bunter Schmetterling tanzt im Sonnenlicht.	sentences
222	pilot7	Die Waschmaschine summt sanft im Hintergrund.	10.0	 Die Waschmaschine summt sanft im Hintergrund.	sentences
223	pilot7	Der gelbe Küchenofen sorgt für Wärme	0.0	 der gelbe	sentences
224	pilot7	Sie isst kein salziges Gericht.	0.0	 Du bist ein Satz ins Gesicht.	sentences
225	pilot7	Die Freunde schauten verwirrt auf ihr Getränk.	-2.0	 Die Freunde schauen im...	sentences
226	pilot7	Schlaf vor Mitternacht ist gesund.	-1.0	 Das Paar.	sentences
227	pilot7	Eine Gruppe Freunde lacht in der Bar.	2.0	 Gute Freunde sitzen im Park.	sentences
228	pilot7	Nicht alle Menschen verkraften den Linksverkehr sofort.	-2.0	 nicht verstanden.	sentences
229	pilot7	Danach kannst Du Dich wirklich richten.	1.0	 im kannst wissen.	sentences
230	pilot7	Er wird ihr ewig treu bleiben.	-1.0	 Nicht verstanden.	sentences
231	pilot7	Der Briefträger bringt die Post.	10.0	 Der Briefträger bringt die Post.	sentences
232	pilot7	Das Baby lachte über die fliegenden Luftballons.	2.0	 Das Baby lacht über die fliegenden Luftballons.	sentences
233	pilot7	Sportliche Jugendliche treffen sich am Fluss.	2.0	 Sportliche Jugendliche treffen sich am Fluss.	sentences
234	pilot7	Es gehört zu einer Feldscheune	-1.0	 Nicht verstanden.	sentences
235	pilot7	Der Besitz des Kiosks ist rechtlich verpfändet.	-1.0	 Der im Kiosk spricht auf Englisch.	sentences
236	pilot7	Die Verkäuferin hat einen ungewöhnlichen Akzent.	2.0	 Die Verkäuferin hat einen ungewöhnlichen Akzent.	sentences
237	pilot7	Kinder spielen fröhlich im Park.	0.0	 Kinder spielen fröhlich im Park.	sentences
0	pilot8	Bei Konkurs kennt der Richter keine Gnade.	2.0	 Bei dem Kurs kennt er keine Gnade.	wordlists_allcorrect
1	pilot8	Du bewirbst dich bei der gepflegten Wirtschaftsbank.	10.0	 Du bewirbst dich bei der gepflegten Wirtschaftsbank.	wordlists_allcorrect
2	pilot8	Die Kaffeetasse dampft auf dem Frühstückstisch.	-1.0	 Die Kaffeetasse stand auf dem Frühstückstisch.	wordlists_allcorrect
3	pilot8	Mein Arzt empfahl dringend Bäder.	0.0	 Mein Arzt empfahl.	wordlists_allcorrect
4	pilot8	Ein Musiker verzaubert die Menschenmenge.	1.0	 Der Musiker verzaubert die Menschenmenge.	wordlists_allcorrect
5	pilot8	Die Nachbarn feiern gemeinsam im Garten.	0.0	 Die Nachbarn feiern gemeinsam den Garten.	wordlists_allcorrect
6	pilot8	Im Dschungel herrscht skrupellose Lebensform.	2.0	 Im Dschungel herrscht skrupellose Lebensform.	wordlists_allcorrect
7	pilot8	Vater will sich eine Pfeife anzünden	-2.0	 Nicht verstanden.	wordlists_allcorrect
8	pilot8	Messer und Gabel liegen neben dem Teller.	-1.0	 Messer und Gabel liegen neben dem Teller.	wordlists_allcorrect
9	pilot8	Die Treppe führt ins kuschelige Schlafzimmer.	-2.0	 Die Treppe führt ins kuschelige Wohnzimmer.	wordlists_allcorrect
10	pilot8	Die Radfahrer erkunden den Wald.	-1.0	 Die Radfahrer erkunden den Wald.	wordlists_allcorrect
11	pilot8	Draußen fliegt die Landschaft vorbei.	10.0	 Draußen fliegt die Landschaft vorbei.	wordlists_allcorrect
12	pilot8	Die Gärtnerin tanzt zwischen den Blumenbeeten.	1.0	 Die Gärtnerin tanzt zwischen den Blumenbeeten.	wordlists_allcorrect
13	pilot8	Ein älteres Ehepaar tanzt auf der Hochzeitsfeier.	-2.0	 Ein älteres Ehepaar tanzt auf der Hochzeitsfeier.	wordlists_allcorrect
14	pilot8	Die Stille singt in fernen Sprachen.	-1.0	 Die Stille sinkt.	wordlists_allcorrect
15	pilot8	Der Nachbar trägt immer Hüte.	0.0	 Der Nachbar trägt immer...	wordlists_allcorrect
16	pilot8	Der Arzt untersucht den Patienten.	0.0	 Der Arzt untersucht den Patienten.	wordlists_allcorrect
17	pilot8	Der Donner murmelt geheime Botschaften.	10.0	 Der Donner murmelt geheime Botschaften.	wordlists_allcorrect
18	pilot8	Das Wasser kocht auf dem Herd.	10.0	 Das Wasser kocht auf dem Herd.	wordlists_allcorrect
19	pilot8	Montag war es uns zu regnerisch.	-2.0	 Montag war es bei uns regnerisch.	wordlists_allcorrect
20	pilot8	Wir hören den plätschernden Bach	0.0	 Nicht verstanden.	wordlists_allcorrect
21	pilot8	Der Kaffee duftet verführerisch am Morgen.	1.0	 Der Kaffee duftet verführerisch am Morgen.	wordlists_allcorrect
22	pilot8	Ein primitiver Mensch wird keine Scheu kennen.	2.0	 Ein primitiver Mensch kennt keine Scheu.	wordlists_allcorrect
23	pilot8	Senioren machen morgendliche Gymnastik im Park.	0.0	machen Gymnastik.	wordlists_allcorrect
24	pilot8	Wir wollen heute spazieren gehen.	-1.0	 Wir wollen heute spazieren gehen.	wordlists_allcorrect
25	pilot8	Die Vögel umkreisten den Turm.	0.0	 die Vögel entkreisten.	wordlists_allcorrect
26	pilot8	Die Tür knarrt beim Öffnen mysteriös.	-2.0	 die Kühe.	wordlists_allcorrect
