	subject	target_sentence	db_cond	response	threshold
181	pilot2	Da möchte ich gerne mit	0.0	 Er müsste ja weg.	sentences
182	pilot2	Ein Stückchen weiter nördlich ist eine Umgehungsstraße	0.0	 Ein Stückchen weiter nördlich ist eine Umgehungsstraße.	sentences
183	pilot2	Nun bin ich mächtig gespannt	0.0	 Nun bin ich mächtig gespannt.	sentences
184	pilot2	In den nächsten Jahren werde ich kein Pökelfleisch mehr essen	2.0	 In den nächsten Jahren möchte ich oder will ich kein Pökelfleisch mehr essen.	sentences
185	pilot2	Sie wringt den Putzlappen aus	0.0	 Sie bringt den Putzlappen raus.	sentences
186	pilot2	Kalbsschnitzel und Kalbsbraten kann ich wärmstens empfehlen	0.0	 Kalbsschnitzel und Kalbsbraten kann ich wärmstens empfehlen.	sentences
187	pilot2	Diese Durchsage ist ohne Gewähr	0.0	 Diese Durchsage ist ohne Gewehr.	sentences
188	pilot2	Der Dachstuhl erhält einen perlweißen Kalkputz	-1.0	 Der Dachstuhl erhält ein halos Papathos.	sentences
189	pilot2	Er löscht nicht nur seinen Durst, er säuft	2.0	 Er löscht nicht seinen Durst, er säuft.	sentences
190	pilot2	In Eurer Wohnung waren Diebe	10.0	 in eurer Wohnung waren Diebe.	sentences
191	pilot2	Den König hat der Putschversuch der Bürger sicher zu Tode erschreckt	0.0	 Der König hat den Putschversuch der Studie wahrlich erschreckt.	sentences
192	pilot2	Ich möchte dir den Tuschkasten abkaufen	-1.0	 Ich möchte Ihren Duschkasten abkaufen.	sentences
193	pilot2	In der Loipe läuft er Schi	0.0	 Der Läufer läuft nur Schienen.	sentences
194	pilot2	Adler fliegen tausend Meter hoch	1.0	 Adler fliegt tausend Meter hoch.	sentences
195	pilot2	Heute jeder Platz: Eins fünfzig	-2.0	 Heute jeder Platz.	sentences
196	pilot2	Wir hören den plätschernden Bach	2.0	 Wir hören den plätschernden Bach.	sentences
197	pilot2	Diese Wohnung liegt zu hoch	1.0	 Diese Wohnung liegt zu hoch.	sentences
198	pilot2	Gut Ding will Weile haben	-2.0	Gut Ding will Weile haben.	sentences
199	pilot2	Sei gewarnt: Sektflaschen können explodieren	0.0	 Die Sektflaschen können explodieren.	sentences
200	pilot2	Allzu lebhafte Kinder machen nervös	-1.0	 Lebhafte Kinder waren nervös.	sentences
201	pilot2	Wenn du den Glühwein durch einen Strohhalm trinkst, kriegst du einen Rausch	10.0	 Wenn du den Glühwein durch einen Strohhalm dringst, kriegst du einen Rausch.	sentences
202	pilot2	Ich müßte lesen und rechnen	-2.0	 Du bist links und rechts.	sentences
203	pilot2	Er schlägt einen Dübel in die Wand	10.0	 Er schlägt einen Dübel in die Wand.	sentences
204	pilot2	Der Karlspreis ist die Sternstunde eines Films	2.0	 Der Verkaufspreis ist die Sternstunde eines Films.	sentences
205	pilot2	Bücher, Zeitschriften und Illustrierte sind in Frankreich auch in Tabakläden erhältlich	2.0	 Bücher, Zeitschriften, Illustrierte sind in Frank sind	sentences
206	pilot2	Achtlos wirft der Knirps Matsch durchs Eckfenster	1.0	 Knirps fest.	sentences
207	pilot2	Nichts verletzt mehr als Spott	-2.0	 Nichts verstanden	sentences
208	pilot2	Am Zaun steht eine Regentonne	1.0	 Am Zaun steht eine Regentonne.	sentences
209	pilot2	Nach diesen Sturmböen herrscht ein furchtbares Chaos	0.0	 Nach diesen Sturmböen herrscht ein furchtbares Chaos.	sentences
210	pilot2	Schnaps im Tee verfälscht das Aroma	2.0	 Schnaps im Tee verfälscht das Aroma.	sentences
211	pilot2	Es wird auch da chinesisch gesprochen	-1.0	 Es wird auf Dach demnächst gesprochen.	sentences
212	pilot2	Voller Glück sind wir am Ziel	2.0	 voller Glück sind wir am Ziel	sentences
213	pilot2	Manche Menschen vertragen keine Erdbeeren	2.0	 Manche Menschen vertragen keine Erdbeeren.	sentences
214	pilot2	Aus dem Radio klingt Musik	1.0	 Aus dem Radio klingt Musik.	sentences
215	pilot2	Er bekam einen Rüffel von höherer Stelle	0.0	 Er bekam einen Rüffel von höherer Stelle.	sentences
216	pilot2	Fünf Filmtitel müssen wir aufschreiben	10.0	 Fünf Filmtitel müssen wir aufschreiben.	sentences
217	pilot2	Öfen brauchen Kohlen und Briketts	-1.0	 Öfen brauchen Kohlen und Briketts.	sentences
218	pilot2	Alle eilen gleich links ins Freie	0.0	 Alle gleich links ins Freie.	sentences
219	pilot2	Durch den ständigen Föhn verdorren die Ähren	0.0	 Haare durch das ständige Föhnen verdauern die Ehre.	sentences
220	pilot2	Der gelbe Küchenofen sorgt für Wärme	0.0	 Küchenofen bären.	sentences
221	pilot2	Bitte, wiederholen Sie die Telephonnummer, die Sie erfragt haben	2.0	 Bitte wiederholen Sie die Telefonnummer, die Sie erfragt haben.	sentences
222	pilot2	Nach der harten Arbeit brauche ich Zerstreuung	-2.0	 Nach der harten Arbeit brauche ich Verstreuer.	sentences
223	pilot2	Englische Kriminalromane sind ihm die liebste Lektüre	0.0	 Englische Kriminalromane sind ihm die liebste Lektüre.	sentences
224	pilot2	Zurück geht's mit der Bahn	10.0	 Zurück gehts mit der Bahn.	sentences
225	pilot2	Wenn der Schnee schmilzt, kommt der Frühling	0.0	 Wenn der Schnee schmilzt, kommt der Folie.	sentences
226	pilot2	Schon bald sind wir zu Hause	-2.0	 Schon bald sind wir zu Hause.	sentences
227	pilot2	Im Januar fährt der Schlepper nach Dänemark	2.0	 Im Januar fährt der Schlepper nach Dänemark.	sentences
228	pilot2	Jeden Freitag gibt's frischen Fisch	0.0	 Jeden Freitag gibt es frischen Fisch.	sentences
229	pilot2	Die letztmalige Feststellung war eindrucksvoll	1.0	 Die letztmalige Feststellung war eindrucksvoll.	sentences
230	pilot2	Opa jammert ständig über seine Asthmaanfälle	2.0	 Opa jammert ständig über seine Asthma-Anfälle.	sentences
0	pilot3	Sechs Mädchen wollen Schwester werden	10.0	 Sechs Mädchen wollen Schwester werden.	sentences
1	pilot3	Nach der harten Arbeit brauche ich Zerstreuung	-2.0	 Nach der harten Arbeit trocknete das Feuer.	sentences
2	pilot3	Sie schießen spöttische Blicke auf den armen Spanier	10.0	Sie schießen spöttische Blicke auf den Arm der Spanier. 	sentences
3	pilot3	Das Mädchen fand diese Muscheln	10.0	 Das Mädchen fand diese Muschel.	sentences
4	pilot3	"Der Förster aus Königstein drohte dem Wilderer mit einer Keule und schrie: ""Hau ab!"""	1.0	 Nahm er seine Keule und schrie Hau ab! Ihn sah	sentences
5	pilot3	Diese Durchsage ist ohne Gewähr	2.0	 Diese Aussage ist ohne Gewähr.	sentences
6	pilot3	Der Pflug zieht tiefe Furchen	1.0	 Der Pflug zieht tiefe Furchen.	sentences
7	pilot3	Mein Dackel pariert auf's Wort	-2.0	 Nicht verstanden.	sentences
8	pilot3	Im Dschungel herrscht skrupellose Lebensform	10.0	 Im Dschungel herrscht skrupellose Lebensform.	sentences
9	pilot3	Der süße Wauwau hat ein reiches Frauchen	1.0	 Der süße Wauwau hat ein reines	sentences
10	pilot3	Mach Dir's bequem, alter Freund	1.0	 Mach dirs bequem, sagte Roy.	sentences
11	pilot3	Motoren brauchen Benzin, Öl und Wasser	1.0	 Nicht verstanden.	sentences
12	pilot3	Ich packe langsam meine Sachen	0.0	 sagte langsam eine Sache.	sentences
13	pilot3	Ich bin dreißig Jahre alt	0.0	 Sie war dreißig Jahre alt.	sentences
14	pilot3	Manche Menschen vertragen keine Erdbeeren	-1.0	 Manche Menschen vertragen keinen Kaffee.	sentences
15	pilot3	Der Frosch sprang rein ins Täschchen	1.0	 Frosch fang einen.	sentences
16	pilot3	Da möchte ich gerne mit	1.0	 nicht verstanden.	sentences
17	pilot3	Ich suche Züge München Nürnberg etwa um Mittag	-2.0	 nicht verstanden.	sentences
18	pilot3	Es gehört zu einer Feldscheune	10.0	Es gehört zu einer Feldscheune.	sentences
19	pilot3	Ein kleines Flämmchen in der Koje der Jolle entwickelte sich zu einem Brand	10.0	 Ein kleines Brändchen in der Koje der Jolle entwickelte sich zu einem Brand.	sentences
20	pilot3	Der smarte Bergsteiger betrachtet furchtlos die Szene	10.0	 Der smarte Bergsteiger betrachtete furchtlos die Szene.	sentences
21	pilot3	Die Rage des Oberstleutnants führt zum Kampf	10.0	 Die Rage des Oberleutnants führt zum Kampf.	sentences
22	pilot3	Der herrische Pate versteht sich als Pol der ganzen Familie	-1.0	 Herrische Pate der ganzen Familie.	sentences
23	pilot3	Die letztmalige Feststellung war eindrucksvoll	10.0	 Die letztmalige Feststellung war eindrucksvoll.	sentences
24	pilot3	Die Aussicht vom Viadukt ist grandios	2.0	 Die Aussicht vom Viadukt ist grandios.	sentences
25	pilot3	Du bewirbst dich bei der gepflegten Wirtschaftsbank	0.0	 Nicht verstanden.	sentences
26	pilot3	In den Bergen kann man gut Schi laufen	2.0	 In den Bergen kann man gut Ski laufen.	sentences
27	pilot3	Die Entscheidung darfst du selbst fällen	1.0	 nicht verstanden.	sentences
28	pilot3	Ich habe Angst, daß der Pilz giftig ist	10.0	 Ich habe Angst, dass der Pilz giftig ist.	sentences
29	pilot3	Geld allein macht nicht glücklich	-1.0	 nicht verstanden.	sentences
30	pilot3	Leise rollen wir aus dem Bahnhof	-1.0	 Der Kaiser rollte aus dem 	sentences
31	pilot3	Der junge Zugbegleiter pfeift zur Abfahrt	1.0	 Der junge Zugbegleiter pfeifte zur Abfahrt.	sentences
32	pilot3	Die Tante bewohnt ein nettes Häuschen	-2.0	 Die Tante besaß ein nettes Häuschen.	sentences
33	pilot3	Hier richten Zimmerleute ein Dach	-2.0	 Hier richten Zimmerleute ein Dach.	sentences
34	pilot3	Du hilfst mir beim Fernstudium	0.0	 Du hilfst mir beim Fernspiel.	sentences
35	pilot3	Kalbsschnitzel und Kalbsbraten kann ich wärmstens empfehlen	1.0	Kalbsbäckchen und Kalbensbraten Kalbsbraten kann ich wärmstens empfehlen. 	sentences
36	pilot3	Schmelzdraht schmilzt bei elfhundert Grad	-2.0	 Nicht verstanden	sentences
37	pilot3	Ängstlich begreifst du Omas Lage	2.0	 Endlich begreifst du Omas Qual.	sentences
38	pilot3	Schnaps im Tee verfälscht das Aroma	2.0	 Schnaps im Tee verfälscht das Aroma.	sentences
39	pilot3	Er wird ihr ewig treu bleiben	0.0	 Freude.	sentences
40	pilot3	Wir gehen auf den Bahnsteig	10.0	 Wir gehen auf den Bahnstreik.	sentences
41	pilot3	Der Karlspreis ist die Sternstunde eines Films	-2.0	 nicht verstanden.	sentences
42	pilot3	Ihr müßt den Rüpel wegjagen	10.0	 Ihr müsst den Rüpel wegjagen.	sentences
43	pilot3	Unser Treffpunkt: Zwei Uhr am Neumarkt	1.0	 Unser Treffpunkt zwei Uhr am Neumarkt.	sentences
44	pilot3	Unsere beiden Hunde haben Durst	-1.0	 haben los.	sentences
45	pilot3	Unserer Tante fehlt gar nichts	10.0	 Unserer Tante fehlt gar nichts.	sentences
46	pilot3	Nach einer Umfrage kennt niemand dieses Fremdwort	10.0	 Nach einer Umfrage kennt niemand dieses Fremdwort.	sentences
47	pilot3	Vati läßt mich Chemie studieren	0.0	 Chemie	sentences
48	pilot3	Nicht jeder verträgt kaltes Bier	-2.0	 Nicht jeder verträgt kaltes	sentences
49	pilot3	Er geht links, sie rechts	2.0	 Er geht links, sie rechts.	sentences
50	pilot3	Er löscht nicht nur seinen Durst, er säuft	10.0	 Er löscht nicht nur seinen Durst, er säuft	sentences
51	pilot3	In jüdischen Gemeinden ist Jiddisch häufig noch eine gängige Sprache	2.0	 ist eben dort eine gängige Sprache	sentences
52	pilot3	Ich müßte lesen und rechnen	2.0	 Er musste lesen und rechnen.	sentences
53	pilot3	Sonntags trinken viele Männer Bier	-2.0	 Sonntags tranken viele Männer Bier.	sentences
54	pilot3	Das Baujahr der Büromöbel liegt lange zurück	1.0	 Claudia Büromöbel	sentences
55	pilot3	Der Bauherr hat in der nahen Strohscheune eine Eule gefangen	0.0	 Eule.	sentences
56	pilot3	Zuvor müssen wir uns stärken	2.0	 zuvor müssen wir uns stärken	sentences
57	pilot3	Der Singvogel schaffts bis in den fernsten Süden	1.0	Der Singvogel singt in den höchsten Tönen. 	sentences
58	pilot3	Beim Elternabend der Hauptschule plant man ein Volksfest	-2.0	In der Hauptschule sich ein Volksfest.	sentences
59	pilot3	Iß dein Essen nie hastig	-1.0	 nicht verstanden.	sentences
60	pilot3	Durch den ständigen Föhn verdorren die Ähren	10.0	 Durch den ständigen Föhn verdorrt die Ähre.	sentences
61	pilot3	Der Mokka ist zu stark	0.0	 Der Mokka ist zu stark.	sentences
62	pilot3	Endlich läuft unser Wasser wieder	10.0	 Endlich läuft unser Wasserweg.	sentences
63	pilot3	Nicht nur in archaischer Zeit gab es bei den Römern viele Götter	-2.0	 Nicht nur zu dieser Jahreszeit gab es bei den Eulern	sentences
64	pilot3	Er schüttelt kräftig Deine Hand	0.0	Er schlug kräftig seine Hand. 	sentences
65	pilot3	Vor der Hütte sitzt ein großer Heuhaufen	1.0	 In der Hütte ist ein großer Heuhaufen.	sentences
66	pilot3	Du brauchst eine Schere und liniiertes Papier	-2.0	 Nicht verstanden.	sentences
67	pilot3	Das ist ein dünnes Gesöff in diesem Bottich	-2.0	 nicht verstanden.	sentences
68	pilot3	Englische Kriminalromane sind ihm die liebste Lektüre	-1.0	 Nicht verstanden.	sentences
69	pilot3	Wir wollen früh fahren und die jüngeren Kinder aus den Ferien zurückholen	2.0	 kamen die jüngeren Kinder aus den Ferien zurück.	sentences
70	pilot3	Er hat Schmerzen im Gesäß	10.0	 Er hat Schmerzen im Gesäß.	sentences
71	pilot3	Der Löwe schleicht im Käfig umher	0.0	 Der Löwe schlich im Käfig umher.	sentences
72	pilot3	Wenn ihr ihm das kostbare Bild abjagen könntet, gäbe es Grund zum Aufjauchzen	10.0	 gäbe es wild abjagen könntet	sentences
73	pilot3	Unsere Eltern tanzen Wiener Walzer	-1.0	 Unsere Eltern tanzen Wiener Walzer.	sentences
74	pilot3	Dauernd klopft es an der Tür	2.0	 Andauernd klopft es an der Tür.	sentences
75	pilot3	Diese Gegend nennt man Sandwüste	10.0	 Diese Gegend nennt man Sandwüste.	sentences
76	pilot3	Vater mischt gleich die Karten	10.0	 Arthur mischt gleich mischt gleich die Karten.	sentences
77	pilot3	Zwei Delfter Vasen überragten einen steinernen Löwen und einen chinesischen Buddha	-1.0	 waren zwei 	sentences
78	pilot3	Mach doch Chemie mit uns	1.0	 nicht verstanden.	sentences
79	pilot3	Das ist nun doch die Höh	1.0	 kloppt wie Höhe, wie Höhe es ist	sentences
80	pilot3	Schnupfen stört uns natürlich sehr	-1.0	 Nicht verstanden.	sentences
81	pilot3	Adler fliegen tausend Meter hoch	2.0	Adler fliegen tausend Meter hoch. 	sentences
82	pilot3	Mein Arzt empfahl dringend Bäder	0.0	 war leer. Mein	sentences
83	pilot3	Es wird auch da chinesisch gesprochen	0.0	 gesprochen.	sentences
84	pilot3	Das Haus neben dem Leuchtturm dient seit Jahren als Unterschlupf	10.0	 Das Haus neben dem Leuchtturm dient seit Jahren als Unterschlupf.	sentences
85	pilot3	Jungen lieben Streit, Mädchen Eintracht	-1.0	Der Junge schreibt, die Mädchen kämpfen.	sentences
86	pilot3	Schon bald sind wir zu Hause	1.0	 nicht verstanden.	sentences
87	pilot3	Dazu essen wir den Salat	-2.0	 So essen wir den Salat.	sentences
88	pilot3	Die üppigen Büsche und Stauden am Tümpel vor dem Teehaus zeigen die ersten Blüten	2.0	vor dem Teehaus zeigen erste	sentences
89	pilot3	Der Verbrecher wollte seinem röchelnden Opfer den Hals abdrehen	10.0	Der Verbrecher wollte seinem röchelnden Opfer den Hals umdrehen. 	sentences
90	pilot3	In Zukunft kommt jeder falsche Versicherungsfall vor das Bezirksgericht	-1.0	 jeder falsche Versicherungsfall vor der	sentences
91	pilot3	Heute jeder Strauß Blumen zwei Mark	2.0	 Heute gibt es einen Strauß Blumen.	sentences
92	pilot3	Schlaf vor Mitternacht ist gesund	10.0	 Schlaf vor Mitternacht ist gesund.	sentences
93	pilot3	Fünf Filmtitel müssen wir aufschreiben	0.0	 Fünf Filmtitel musst du aufschreiben.	sentences
94	pilot3	Ein primitiver Mensch wird keine Scheu kennen	0.0	 Ein mutiger Mensch wird keine Scheu kennen.	sentences
95	pilot3	Sei gewarnt: Sektflaschen können explodieren	-1.0	 Sektflaschen können explodieren.	sentences
96	pilot3	Wir haben ein Abteil extra für uns	1.0	 Wir haben einen Kutter extra für uns.	sentences
97	pilot3	Mich drückt der linke Schuh	0.0	 Schuhe	sentences
98	pilot3	Ich will am Montag um acht Uhr nach Stuttgart	1.0	 Ich fliege am Montag um acht Uhr nach Stuttgart.	sentences
99	pilot3	Ich brauche den nächsten Zug nach München	2.0	 Ich brauche den nächsten Zug nach München.	sentences
100	pilot3	Nervöse Menschen brauchen viel Ruhe	10.0	 Nervöse Menschen brauchen viel Ruhe.	sentences
101	pilot3	Ich will keine Zeit durch weitere nutzlose Bemühungen vergeuden	-2.0	 Es war keine Zeit für Nutzlose.	sentences
102	pilot3	Einige Busse fahren heute später	-2.0	 Einige Fischer waren zu spät.	sentences
103	pilot3	Das amtliche Amtsblatt liegt überm Durchschnitt	2.0	 blickte vor Deutschen.	sentences
104	pilot3	Er ist zwar kein Genie, aber doch ein fähiger Ingenieur	0.0	 Er ist zwar kein Genie, aber doch ein fähiger Ingenieur.	sentences
105	pilot3	Wenn der Schnee schmilzt, kommt der Frühling	-1.0	 Wenn der Schnee schmilzt, kommt der Regen.	sentences
106	pilot3	Bei Konkurs kennt der Richter keine Gnade	10.0	 Bei Konkurs kennt der Richter keine Gnade.	sentences
107	pilot3	Böse Menschen verdienen ihre Strafe	1.0	 Böse Menschen verdienen ihre Strafe.	sentences
108	pilot3	Gut Ding will Weile haben	-1.0	 Nicht verstanden.	sentences
109	pilot3	Die Skizzen sind sich ähnlich	2.0	 Die Skizzen sind sich ähnlich.	sentences
110	pilot3	Im Hauptquartier rüsten sich die Bergsteiger zur Erstbesteigung des Berges	2.0	 Nicht verstanden.	sentences
111	pilot3	Bei dem Peitschenknall scheuten die Rösser	2.0	 bei der Zeit.	sentences
112	pilot3	Sie wollen ein Reh jagen	10.0	 Sie wollen ein Reh jagen.	sentences
113	pilot3	Freilich, trockenes Wetter brauchen wir	2.0	 Wetter brauchte er.	sentences
114	pilot3	Dienstag wieder frisch gebrannte Mandeln	-2.0	 frisch gebrannte	sentences
115	pilot3	Auch der Elefant ist ein Geschöpf Gottes	10.0	 Auch der Elefant ist ein Geschöpf Gottes.	sentences
116	pilot3	Jeden Freitag gibt's frischen Fisch	-1.0	 Jeden Freitag gibt es Fisch.	sentences
117	pilot3	Unsere Söhne lieben flotte Tänze	0.0	 Unsere Söhne lieben flotte Tänze.	sentences
118	pilot3	Dieses Öfchen sieht aber hübsch aus	-1.0	 Dieses Böhnchen sieht aber hübsch aus.	sentences
119	pilot3	Sie hat die Neuigkeit mit Genugtuung aufgenommen	0.0	 Sie hatte Neuigkeiten.	sentences
120	pilot3	Unser Doktor besucht Vater täglich	1.0	 besucht Vater täglich. Unser	sentences
121	pilot3	Es ist schade, daß die mühsam geebnete Beziehung von so kurzer Dauer war	-2.0	 geebnete Beziehung von so kurzer Dauer war, dass die	sentences
122	pilot3	Mit einem Ringchen wird die Gangschaltung wieder gangbar	10.0	 Mit einem Ringchen wird die Gangschaltung wieder gangbar.	sentences
123	pilot3	Wir hören den plätschernden Bach	2.0	 Plätschernde.	sentences
124	pilot3	Wut, Neid und ständige Drohungen und Schmähungen kennzeichnen sein Verhalten	10.0	Leid und ständige Drohungen und Schmähungen kennzeichnen sein Verhalten. 	sentences
125	pilot3	Es geht hier ums Prinzip	2.0	 Es geht hier ums Prinzip.	sentences
126	pilot3	Keiner darf diesen Raum verlassen	-2.0	 Keiner darf diesen Raum verlassen.	sentences
127	pilot3	Leider ist dies Haus teuer	10.0	 Leider ist dies Haus teuer.	sentences
128	pilot3	Ich benötige eine Zugverbindung von München nach Aachen	0.0	 Ich möchte eine Zugverbindung von München nach Prag.	sentences
129	pilot3	Nicht alle Menschen verkraften den Linksverkehr sofort	-1.0	 Nicht alle Menschen verkraften den Linksverkehr sofort.	sentences
130	pilot3	Der fünfzehige Fuß kommt in der Tierwelt häufig vor	2.0	kommt in der hm nicht vor. Fuß.	sentences
131	pilot3	Alle eilen gleich links ins Freie	-2.0	Alle eilten gleich links ins Freie.	sentences
132	pilot3	Zum Ausweis gehört ein Lichtbild	10.0	 Zum Ausweis gehört ein Lichtbild.	sentences
133	pilot3	Allzu lebhafte Kinder machen nervös	1.0	 Machen nervös!	sentences
134	pilot3	Wenn du den Glühwein durch einen Strohhalm trinkst, kriegst du einen Rausch	2.0	wenn du den Glühwein aus einem Strohhalm trinkst, gibt es einen Rausch.	sentences
135	pilot3	Am Samstag öffnet der Kiosk erstmals	-2.0	 Am Samstag	sentences
136	pilot3	Die Fahrt war ja mächtig kurz	-1.0	 nicht verstanden.	sentences
137	pilot3	Diese Wohnung liegt zu hoch	0.0	 Diese Boje hängt zurück.	sentences
138	pilot3	Wer früh aufsteht, kann früh hingehen	1.0	 Wer früh aufsteht.	sentences
139	pilot3	Die Kartoffeln gehören zum Mittagessen	-1.0	 zum Mittagessen.	sentences
140	pilot3	Diese Mannschaft schoß gleich drei Tore	-1.0	 Diese Mannschaft schoss gleich drei Tore.	sentences
141	pilot3	Die Rauhigkeit des Holzes beeinträchtigt nicht die Schönheit des gotischen Chorgestühls	0.0	 Punkt, Punkt, Punkt	sentences
142	pilot3	Danach tut eine Wanderung gut	2.0	 Danach folgte eine Wanderung.	sentences
143	pilot3	Der gelbe Küchenofen sorgt für Wärme	1.0	 Er ging auf den Hof, um zu lernen.	sentences
144	pilot3	In der Loipe läuft er Schi	2.0	 In der Loipe läuft er Schi	sentences
145	pilot3	Bitte, wiederholen Sie die Telephonnummer, die Sie erfragt haben	-1.0	 Bitte wiederholen Sie die Telefonnummer, die Sie erfahren haben.	sentences
146	pilot3	Stehend macht man seine Aussage	1.0	 Er machte seine Aussage.	sentences
147	pilot3	Ich bin nicht naß geworden	1.0	 Nicht naß geworden.	sentences
148	pilot3	"""Zug endet hier!"" verkündet die Ansage"	0.0	 kündete oh Punkt punkt punkt hier	sentences
149	pilot3	Sie döst müde vor sich hin	2.0	 Sie las müde vor sich hin.	sentences
150	pilot3	Öffnet doch gleich beide Türen	10.0	 Öffnet doch gleich beide Türen.	sentences
151	pilot3	Durch Wald und Feld führt unser Weg	2.0	 Durch Wald und Fels führt unser Weg.	sentences
152	pilot3	Am Zaun steht eine Regentonne	-2.0	 Am Zaun steht eine Regentonne.	sentences
153	pilot3	Nun sind wir gleich im Wagen	-1.0	 Er musste sie gleich waschen.	sentences
154	pilot3	Da läuft der Zug ein	-2.0	 nicht verstanden.	sentences
155	pilot3	Mittwoch kommt uns Besuch passend	-1.0	 Sie sieht passend aus.	sentences
156	pilot3	Das war jetzt aber ein schöner Tag	0.0	 Das war jetzt aber ein schöner Tag.	sentences
157	pilot3	Auf dem Brett leuchten bunte Tulpen	1.0	 auf punkt punkt tobte der	sentences
158	pilot3	Wir werden Euch nie vergessen	-1.0	 Nicht vergessen!	sentences
159	pilot3	Er bekam einen Rüffel von höherer Stelle	1.0	 Er bekam eine Runde.	sentences
160	pilot3	Die drei Männer sind begeistert	-2.0	 Die drei Männer sind begeistert.	sentences
161	pilot3	Die Hilfsmannschaft setzt sich in Marsch	0.0	 Die Hilfsmannschaft setzte sich in Marsch. 	sentences
162	pilot3	Ich brauche heute eine Verbindung ab Köln	1.0	 eine Verbindung nach Köln. Die Frau brauchte	sentences
163	pilot3	Öfen brauchen Kohlen und Briketts	2.0	 und Briketts.	sentences
164	pilot3	Laß bitte das Licht brennen	2.0	 das Ende des Lichts.	sentences
165	pilot3	Nun bin ich mächtig gespannt	-2.0	 Er war mächtig gespannt.	sentences
166	pilot3	Verkehrsampeln leuchten grün, gelb, rot	-1.0	 Die Verkehrsampel leuchtete grün, gelb und rot.	sentences
167	pilot3	Danach kannst Du Dich wirklich richten	-1.0	 Danach kannst du dich wieder	sentences
168	pilot3	Voller Glück sind wir am Ziel	-1.0	 Sieg, voller punkt punkt punkt	sentences
169	pilot3	Nehmt doch Butter zum Brot	0.0	 nicht verstanden.	sentences
170	pilot3	Nachts merkst du die Furcht	1.0	 Nachts?	sentences
171	pilot3	Opa jammert ständig über seine Asthmaanfälle	0.0	 ständig in seine	sentences
172	pilot3	Guten Morgen, meine Damen und Herren	-1.0	 Guten Morgen, meine Damen und Herren.	sentences
173	pilot3	Alle Kritiker rühmen das mit großer Verzögerung erschienene neue Jugendbuch	10.0	Alle Kritiker rühmen das mit großer Verzögerung erschienene Buch. 	sentences
174	pilot3	Sie ißt kein salziges Gericht	2.0	 Sie isst ein salziges Gericht.	sentences
175	pilot3	Du begrüßt erst Deinen Gast	-1.0	 Begrüß erst deinen Gast.	sentences
176	pilot3	Alle Kinder essen gern Eis	0.0	 Alle Kinder essen gerne Eis.	sentences
177	pilot3	Bücher, Zeitschriften und Illustrierte sind in Frankreich auch in Tabakläden erhältlich	-1.0	Bücher, Zeitschriften und Illustrierte sind in Frankreich auch 	sentences
178	pilot3	Wir danken Ihnen für die freundliche Unterstützung und hoffen weiterhin auf gute Zusammenarbeit	-2.0	 und freue mich auf die weitere Zusammenarbeit.	sentences
179	pilot3	Wir wollen heute spazieren gehen	-1.0	 Wir wollen heute spazieren gehen.	sentences
180	pilot3	Du darfst dich wieder setzen	-1.0	Er kann sich wieder setzen. 	sentences
181	pilot3	Ein Bauer arbeitet auf seinem Acker	-2.0	 der Bauer arbeitete	sentences
182	pilot3	Sie gehen in die Oper	-2.0	 nicht verstanden.	sentences
183	pilot3	Heute jeder Platz: Eins fünfzig	0.0	 Heute jeder Platz eins	sentences
184	pilot3	Vom Marktplatz an folgst du erstmals den gelbblauen Punkten	10.0	Vom Marktplatz an folgst du erstmals den blau-gelben Punkten. 	sentences
185	pilot3	Im Topf kocht das Wasser	-1.0	 Mutter sagt was	sentences
186	pilot3	Achtlos wirft der Knirps Matsch durchs Eckfenster	10.0	Wirft der Knirps punkt punkt punkt durch das Fenster.	sentences
187	pilot3	Die Bremse quietscht beim linkslastigen Bremsen	-2.0	 nicht verstanden.	sentences
188	pilot3	Vor Erschöpftheit warten wir das Ende des Kampfs nicht ab	1.0	 Warten wir das Ende.	sentences
189	pilot3	Die Abfangjäger flogen auch an Neujahr über das Dörfchen	0.0	Abfangjäger flogen auf einen	sentences
190	pilot3	Prinzipiell müssen alle Hunde ein Halsband tragen	10.0	 Prinzipiell mussten alle Hunde ein Halsband tragen.	sentences
191	pilot3	Abends lieber zeitig schlafen gehen	1.0	 Zeitstrafen.	sentences
192	pilot3	Es ist zäh wie Leder	1.0	 Leder	sentences
193	pilot3	Erste Stunde Deutsch, dann Englisch	-1.0	punkt punkt punkt Dann links.	sentences
194	pilot3	Er ist in diesem Jahr Strohwitwer	2.0	Er ist in diesem Jahr. 	sentences
195	pilot3	Nach diesen Sturmböen herrscht ein furchtbares Chaos	-1.0	 Nach dieser Sturmböe herrscht ein furchtbares Chaos.	sentences
196	pilot3	Für Volkskunst schwärmt nicht jede Altersstufe	2.0	 Hat nicht jeder Volks	sentences
197	pilot3	Die Tragödie wurde mit langdauernden Gongschlägen eröffnet	-2.0	 nicht verstanden.	sentences
198	pilot3	Ich will morgen abend nach Frankfurt	2.0	 Sie flogen ab nach Frankfurt.	sentences
199	pilot3	Ein Sofa steht an der Wand	-1.0	 Wand über	sentences
200	pilot3	In den nächsten Jahren werde ich kein Pökelfleisch mehr essen	2.0	 In den nächsten Jahren werde ich kein Pökelfleisch mehr essen.	sentences
