	subject	target_sentence	db_cond	response	threshold
216	sub03	Bei Konkurs kennt der Richter keine Gnade.	0.0	 Beim Konkurs kennt der Richter keine Gnade.	wordlists_1correct
217	sub03	Flüsternd erzählt der Wind Geschichten.	10.0	 Flüsternd erzählt der Wind Geschichten.	wordlists_1correct
218	sub03	Er wird ihr ewig treu bleiben.	10.0	 Er wird dir ewig treu bleiben.	wordlists_1correct
219	sub03	Der Apfelbaum trägt viele reife Äpfel.	10.0	 Der Apfelbaum trägt viele Reife Äpfel.	wordlists_1correct
220	sub03	Unsere beiden Hunde haben Durst.	-2.0	 Nicht verstanden.	wordlists_1correct
221	sub03	Der Kellner jongliert mit den Speisekarten.	10.0	 Der Kellner jongliert mit den Speisekarten.	wordlists_1correct
222	sub03	Alle eilen gleich links ins Freie.	-2.0	 Nicht verstanden.	wordlists_1correct
223	sub03	Der Zug rattert laut durch die Nacht.	10.0	 Der Zug rattert laut durch die Nacht.	wordlists_1correct
224	sub03	Nervöse Menschen brauchen viel Ruhe.	2.0	 Nervöse Menschen brauchen ihre Ruhe.	wordlists_1correct
225	sub03	Ein Paar tanzt unter dem Sternenhimmel.	1.0	 Das Paar tanzt unter dem Sternenhimmel.	wordlists_1correct
226	sub03	Ein älteres Paar spaziert Hand in Hand.	2.0	 Hand in Hand.	wordlists_1correct
227	sub03	Es gehört zu einer Feldscheune	-2.0	 Das gehört zu einer Scheune.	wordlists_1correct
228	sub03	Ein primitiver Mensch wird keine Scheu kennen.	-1.0	 Nicht verstanden.	wordlists_1correct
229	sub03	Die Straßenlaternen leuchten im Abendnebel.	-1.0	 Die Straßenlaternen leuchten im Abendhimmel.	wordlists_1correct
230	sub03	Nach dem Aufräumen fand ich mein Buch.	0.0	 Nach dem Aufräumen folgt	wordlists_1correct
231	sub03	Der Kühlschrank summt seltsame Melodien.	2.0	 Der Kühlschrank summt seltsame Melodien.	wordlists_1correct
232	sub03	Die Straßenlaterne spendet warmes Licht.	10.0	 Die Straßenlaterne spendet warmes Licht.	wordlists_1correct
233	sub03	Opa jammert ständig über seine Asthmaanfälle.	-1.0	 Opa jammert ständig über seine.	wordlists_1correct
234	sub03	Im Alltag herrscht eine gnadenlose Hektik.	2.0	 Im Alltag herrscht gnadenlose Hektik.	wordlists_1correct
235	sub03	Der Regenschirm schützt vor plötzlichem Regen.	2.0	 Der Regenschirm schützt vor plötzlichen Regen.	wordlists_1correct
236	sub03	Der Mondschein taucht die Landschaft in Silber.	-2.0	 Der Mondschein taucht die Landschaft in Silber.	wordlists_1correct
237	sub03	Ein ruhiger Bach plätschert durch den Wald.	10.0	 Ein ruhiger Bach plätschert durch den Wald.	wordlists_1correct
238	sub03	Der Hund bellt vor dem Haus.	10.0	 Der Hund bellt vor dem Haus.	wordlists_1correct
0	sub04	Die Kaffeetasse dampft auf dem Frühstückstisch.	-2.0	 Kaffeetasse, Dampflok.	wordlists_1correct
1	sub04	Adler fliegen tausend Meter hoch.	-2.0	 Nicht verstanden.	wordlists_1correct
2	sub04	Einige Busse fahren heute später.	10.0	 Einige Busse fahren heute später.	wordlists_1correct
3	sub04	Der Nachbar trägt immer Hüte.	1.0	 Der Nachbar.	wordlists_1correct
4	sub04	Der Regen spielt Klavier auf den Dächern.	-2.0	 nicht verstanden.	wordlists_1correct
5	sub04	Ein Lächeln erhellt das Gesicht.	0.0	 Ein Lächeln erhellt das Gesicht.	wordlists_1correct
6	sub04	Der Laptop surft schnell im Internet.	-2.0	 Der Laptop.	wordlists_1correct
7	sub04	Der Nachbar trägt heute einen bunten Anzug.	10.0	 Der Nachbar trägt heute einen bunten Anzug.	wordlists_1correct
8	sub04	Du bewirbst dich bei der gepflegten Wirtschaftsbank.	0.0	 nicht verstanden.	wordlists_1correct
9	sub04	Am Samstag öffnet der Kiosk erstmals.	-2.0	 Am Samstag	wordlists_1correct
10	sub04	Die Tante bewohnt ein nettes Häuschen	0.0	 Nicht verstanden.	wordlists_1correct
11	sub04	Das Wasser kocht auf dem Herd.	1.0	 Das Wasser kocht auf dem Herd.	wordlists_1correct
12	sub04	Fünf Freunde wollen die Welt bereisen.	1.0	 Fünf Freunde wollen die Welt bereisen.	wordlists_1correct
13	sub04	Danach tut eine Wanderung gut.	1.0	 nicht verstanden.	wordlists_1correct
14	sub04	Der Fluss plätschert sanft durch das Tal.	-1.0	 Der Fluss plätschert sanft durch das Tal.	wordlists_1correct
15	sub04	Die weiße Leinwand wird vom Maler beschriftet.	2.0	 Die weiße Leinwand wird vom Maler gestrichen.	wordlists_1correct
16	sub04	Die Katze schläft auf dem Sofa	0.0	 Katze.	wordlists_1correct
17	sub04	Die Sonne scheint am blauen Himmel.	-2.0	 Nicht verstanden.	wordlists_1correct
18	sub04	Die Sterne funkeln am Nachthimmel.	2.0	 die Sterne funkeln in der Nacht.	wordlists_1correct
19	sub04	Unruhig tanzen Blätter im Sonnenschein.	1.0	 Irgendwas Blätter.	wordlists_1correct
20	sub04	Der Regen prasselt auf das Dachfenster.	1.0	 Der Regen auf das Dachfenster.	wordlists_1correct
21	sub04	Durch Wald und Feld führt unser Weg.	1.0	 Nicht verstanden.	wordlists_1correct
22	sub04	Der Zug rattert laut durch die Nacht.	2.0	 der Zug.	wordlists_1correct
23	sub04	Das Baby lachte über die fliegenden Luftballons.	0.0	 nicht verstanden.	wordlists_1correct
24	sub04	Der Kühlschrank summt seltsame Melodien.	1.0	 Der Kühlschrank summt seltsame Melodien.	wordlists_1correct
25	sub04	Sportliche Jugendliche treffen sich am Fluss.	10.0	 Sportliche Jugendliche treffen sich am Fluss.	wordlists_1correct
26	sub04	Sie läuft entspannt am Strand entlang.	2.0	 Sie läuft entspannt am Strand entlang.	wordlists_1correct
27	sub04	Die Bäckerin singt fröhlich beim Brötchenbacken.	2.0	 Die Bäckerin fröhlich Brötchen backen.	wordlists_1correct
28	sub04	Flüsternd erzählt der Wind Geschichten.	2.0	 Flüstern der Windgeschichten	wordlists_1correct
29	sub04	Das war jetzt aber ein schöner Tag.	-1.0	 nicht verstanden.	wordlists_1correct
30	sub04	Die Blumen blühen im sonnigen Garten.	1.0	 die Blumen blühen.	wordlists_1correct
31	sub04	Löst doch die Fahrkarten am Schalter!	-1.0	 Flackert.	wordlists_1correct
32	sub04	Vor dem Haus blühen bunte Blumenbeete.	0.0	 vor dem Haus.	wordlists_1correct
33	sub04	Der Postbote liest Gedichte beim Zustellen.	-1.0	 der Postbote.	wordlists_1correct
34	sub04	Die Blumen blühen im Garten.	0.0	 Die Blumen blühen im Garten.	wordlists_1correct
35	sub04	Draußen fliegt die Landschaft vorbei.	-1.0	 Draußen die Landschaft.	wordlists_1correct
36	sub04	Zwei Mannschaften kämpfen um den Sieg.	10.0	 Zwei Mannschaften um den Sieg.	wordlists_1correct
37	sub04	Geld allein macht nicht glücklich.	10.0	 Geld alleine macht nicht glücklich.	wordlists_1correct
38	sub04	Der Kaffee duftet sehr verlockend.	-2.0	 Der Kaffee duftet sehr verlockend.	wordlists_1correct
39	sub04	Nach einer Umfrage kennt niemand dieses Fremdwort.	-1.0	 Nicht verstanden.	wordlists_1correct
40	sub04	Die Vögel umkreisten den Turm.	-1.0	 Der Flügel.	wordlists_1correct
41	sub04	Einstweilen ist Erfolg die Hauptsache.	-1.0	 Eins, zwei...	wordlists_1correct
42	sub04	Das Echo trägt Gedichte fort.	2.0	 Das Echo, dich fort.	wordlists_1correct
43	sub04	In den Bergen kann man Ski laufen.	0.0	 In den Bergen kann man viel laufen.	wordlists_1correct
44	sub04	Im Park traf ich meinen Deutschlehrer.	10.0	 Im Park traf ich meinen Deutschlehrer.	wordlists_1correct
45	sub04	Sie hört Musik mit geschlossenen Augen.	10.0	 Sie hörten Musik mit geschlossenen Augen.	wordlists_1correct
46	sub04	Auf dem Dach singt fröhlich ein Vogel.	0.0	 Auf dem Dach fröhlich ein Vogel.	wordlists_1correct
47	sub04	Ein Künstler malt Porträts auf dem Marktplatz.	-1.0	 Ein Künstler malte	wordlists_1correct
48	sub04	Der alte Baum erzählte vom Leben.	1.0	 Leben.	wordlists_1correct
49	sub04	Das Buch liegt auf dem gemütlichen Sofa.	-2.0	 Nicht verstanden.	wordlists_1correct
50	sub04	Wir hören den plätschernden Bach	-1.0	 Wir hören.	wordlists_1correct
51	sub04	Sein Blick fiel auf den Boden.	2.0	 Sein Blick fiel auf den Boden.	wordlists_1correct
52	sub04	Danach kannst Du Dich wirklich richten.	1.0	 Nicht verstanden.	wordlists_1correct
53	sub04	Schnaps im Tee verfälscht das Aroma.	0.0	 Schnaps im Tee verfälscht das Aroma.	wordlists_1correct
54	sub04	Ein bunter Schmetterling tanzt im Sonnenlicht.	-2.0	 Nicht verstanden.	wordlists_1correct
55	sub04	Seine Frau macht ein trauriges Gesicht.	10.0	 Meine Frau macht ein trauriges Gesicht.	wordlists_1correct
56	sub04	Der Mondschein taucht die Landschaft in Silber.	10.0	 Der Mondschein taucht die Landschaft in Silber.	wordlists_1correct
57	sub04	Der Kaffee duftet verführerisch am Morgen.	10.0	 Der Kaffee duftet verführerisch am Morgen.	wordlists_1correct
58	sub04	Die Freunde teilen Geschichten am Lagerfeuer.	-2.0	 Freunde teilen.	wordlists_1correct
59	sub04	Die Waschmaschine summt sanft im Hintergrund.	1.0	 die Sanfte.	wordlists_1correct
60	sub04	Ein freundliches Lächeln erhellt den Tag.	10.0	 Ein freundliches Lächeln erhält den Tag.	wordlists_1correct
61	sub04	Sechs Mädchen wollen Schwester werden.	1.0	 Nicht verstanden.	wordlists_1correct
62	sub04	Die Hochzeit versammelt Familie und Freunde.	10.0	 Die Hochzeit versammelt Familie und Freunde.	wordlists_1correct
63	sub04	Das Café ist Treffpunkt für Gespräche.	2.0	 Das Kaffee ist... für Gespräche.	wordlists_1correct
64	sub04	Der Besitz des Kiosks ist rechtlich verpfändet.	0.0	 Der Besitzer des Kiosks.	wordlists_1correct
65	sub04	Die Tomate im Kühlschrank keimte.	10.0	 Die Tomate im Kühlschrank keimte.	wordlists_1correct
66	sub04	Die Kartoffeln gehören zum Mittagessen	2.0	 Die Kartoffeln gehören zum Mittagessen.	wordlists_1correct
67	sub04	Über die Felder weht ein Wind	-1.0	 Nicht verstanden.	wordlists_1correct
68	sub04	Er hat eine sprunghafte Gangart.	-2.0	 Er hat eine	wordlists_1correct
69	sub04	Englische Kriminalromane sind ihm die liebste Lektüre.	0.0	 Englische Kriminalromane.	wordlists_1correct
70	sub04	Durch den Regen leuchtet das Feuer.	0.0	 Durch den leuchtet das Feuer.	wordlists_1correct
71	sub04	Ein Paar tanzt unter dem Sternenhimmel.	-1.0	 Ein Paar tanzt unter den Sternen.	wordlists_1correct
72	sub04	Ein ruhiger Bach plätschert durch den Wald.	-2.0	 nicht verstanden.	wordlists_1correct
73	sub04	Im Meer tummeln sich faszinierende Lebensformen.	-2.0	 Nicht verstanden.	wordlists_1correct
74	sub04	Es gehört zu einer Feldscheune	2.0	 Das zu einer Feldscheune.	wordlists_1correct
75	sub04	Durch den ständigen Föhn verdorren die Ähren.	-1.0	 durch.	wordlists_1correct
76	sub04	Frische Gardinen hängen am Fenster.	1.0	 nicht verstanden.	wordlists_1correct
77	sub04	Der Wecker klingelt zur gewohnten Zeit.	-2.0	 des Gehirns.	wordlists_1correct
78	sub04	Im Dschungel herrscht skrupellose Lebensform.	1.0	 Im Dschungel herrscht Lebensform.	wordlists_1correct
79	sub04	Nach dem Aufräumen fand ich mein Buch.	10.0	 Nach dem Aufräumen fand ich mein Buch.	wordlists_1correct
80	sub04	Der Bus fährt durch die Stadt.	1.0	 Der Bus fährt durch die Stadt.	wordlists_1correct
81	sub04	Die Lampe spendet angenehmes, helles Licht.	-1.0	 Die Lampe spendet angenehm helles Licht.	wordlists_1correct
82	sub04	Der Regenschirm schützt vor plötzlichem Regen.	-1.0	 Der Regenschirm schützt vor plötzlichem Regen.	wordlists_1correct
83	sub04	Das Telefon klingelt in der stillen Wohnung.	-2.0	 Das Telefon in der stillen Wohnung.	wordlists_1correct
84	sub04	In der Wüste flirrt die Hitze.	-2.0	 nicht verstanden.	wordlists_1correct
85	sub04	Zwölf Wanderer wollen den Gipfel erklimmen.	-2.0	 Nicht verstanden.	wordlists_1correct
86	sub04	Diese zarten Blumen welken rasch.	10.0	 Diese zarten Blumen welken rasch.	wordlists_1correct
87	sub04	Der alte Baum knarrt bei jedem Windstoß.	1.0	 Alter Windschutz.	wordlists_1correct
88	sub04	Das amtliche Amtsblatt liegt überm Durchschnitt.	-1.0	 nicht verstanden.	wordlists_1correct
89	sub04	Der Apfelbaum trägt viele reife Äpfel.	0.0	 Der Apfelbaum trägt viele reife Äpfel.	wordlists_1correct
90	sub04	Die Treppe führt ins kuschelige Schlafzimmer.	0.0	 Nicht verstanden.	wordlists_1correct
91	sub04	Sie isst kein salziges Gericht.	0.0	 nicht verstanden.	wordlists_1correct
92	sub04	Unserer Tante fehlt gar nichts.	2.0	 Unserer Pflanze fehlt gar nichts.	wordlists_1correct
93	sub04	Im Alltag herrscht eine gnadenlose Hektik.	-1.0	 Im Alltag herrscht	wordlists_1correct
94	sub04	Eine Gruppe Freunde lacht in der Bar.	0.0	 die Freunde.	wordlists_1correct
95	sub04	Durch die Straßen zieht eine kalte Brise.	10.0	 Durch die Straßen zieht ein kalter Winter.	wordlists_1correct
96	sub04	Der Fernseher zeigt die Nachrichten.	2.0	 Der Fernseher zeigt Liebesfilme	wordlists_1correct
97	sub04	Die Hilfsmannschaft setzt sich in Marsch.	1.0	 Nicht verstanden.	wordlists_1correct
98	sub04	Diese Gegend nennt man Sandwüste.	10.0	 Diese Gegend nennt man Sandwüste.	wordlists_1correct
99	sub04	Ein primitiver Mensch wird keine Scheu kennen.	10.0	 Ein Mensch wird keine Scheu kennen.	wordlists_1correct
100	sub04	Bei dem Peitschenknall scheuten die Rösser.	10.0	 Bei dem Peitschenknall scheuten die Rösser.	wordlists_1correct
101	sub04	Schlaf vor Mitternacht ist gesund.	-1.0	Nicht verstanden	wordlists_1correct
102	sub04	Der Hund las heimlich die Zeitung.	1.0	 Der las die Zeitung.	wordlists_1correct
103	sub04	Auf dem Brett leuchten bunte Tulpen.	10.0	 Auf dem Bett leuchten bunte Tulpen.	wordlists_1correct
104	sub04	Sein Singen erfüllte den stillen Wald.	0.0	 Sein Sing erfüllte den Wald.	wordlists_1correct
105	sub04	Die Melodie klingt nach Sommer.	1.0	 nach Sommer.	wordlists_1correct
106	sub04	Der Polizist spielt Gitarre für die Nachbarschaft.	0.0	 der Polizist für die Nachbarschaft	wordlists_1correct
107	sub04	Sie hat die Neuigkeit mit Genugtuung aufgenommen.	0.0	 Nicht verstanden.	wordlists_1correct
108	sub04	Im Geschäft stehen viele Leute	-2.0	 Im Geschäft stehen die Leute.	wordlists_1correct
109	sub04	Vor dem Schloss wartet eine einsame Gestalt.	0.0	Vor dem Schloss wartet eine einsame	wordlists_1correct
110	sub04	Das Licht tanzte über dem Fluss.	-2.0	 nicht verstanden.	wordlists_1correct
111	sub04	Der Briefträger bringt die Post.	10.0	 Der Briefträger bringt die Post.	wordlists_1correct
112	sub04	Die Straßen sind voller fröhlicher Passanten.	-2.0	 nicht verstanden.	wordlists_1correct
113	sub04	Alle eilen gleich links ins Freie.	0.0	 nicht verstanden.	wordlists_1correct
114	sub04	Autos fahren auf der Straße.	2.0	 Autos fahren auf der Straße.	wordlists_1correct
115	sub04	Der Termin des Treffpunkts wird noch abgesprochen	10.0	 Der Termin des Treffpunkts wird noch abgesprochen.	wordlists_1correct
116	sub04	Kollegen feiern den Abschluss eines erfolgreichen Projekts.	1.0	 Die Kollegen feiern den Abschluss eines erfolgreichen	wordlists_1correct
117	sub04	Im Gebirge glitzern die schneebedeckten Gipfel.	-1.0	 schneebedeckten	wordlists_1correct
118	sub04	Die Freunde schauten verwirrt auf ihr Getränk.	0.0	 Die Freunde verwirrt ihr Getränk.	wordlists_1correct
119	sub04	Das Fahrrad rollt leise über Kopfsteinpflaster.	-1.0	 leise.	wordlists_1correct
120	sub04	Die Ärzte sind damit gar nicht einverstanden.	2.0	 nicht verstanden.	wordlists_1correct
121	sub04	Vor dem Fenster summt eine kleine Biene.	0.0	 Fenster sucht ein Klein.	wordlists_1correct
122	sub04	Der Löwe schleicht im Käfig umher.	0.0	 Nicht verstanden.	wordlists_1correct
123	sub04	Ein Stückchen weiter nördlich ist eine Umgehungsstraße.	2.0	 Straße.	wordlists_1correct
124	sub04	Die Krankenschwester jongliert mit Medikamenten.	-1.0	Mit Medikamenten	wordlists_1correct
125	sub04	Sein Blick streifte die Sterne.	-1.0	 Sein Blick streifte die Sterne.	wordlists_1correct
126	sub04	In der Bucht glitzern die silbernen Wellen.	-2.0	 Silberne Wellen.	wordlists_1correct
127	sub04	Auch der Elefant ist ein Geschöpf Gottes.	10.0	 Auch der Elefant ist ein Geschöpf Gottes.	wordlists_1correct
128	sub04	Der Hund bellt vor dem Haus.	-2.0	 Der Hund bellt. Haus.	wordlists_1correct
129	sub04	Am Himmel fliegt ein Schwarm Zugvögel vorbei.	0.0	 Am Himmel fliegt ein Zugvögel vorbei.	wordlists_1correct
130	sub04	Der Fernseher spielt eigenwillige Liebesfilme.	2.0	 Der Fernseher spielt einige	wordlists_1correct
131	sub04	Die Radfahrer erkunden den Wald.	-1.0	 den Wald.	wordlists_1correct
132	sub04	Der Regen tropft vom Dach.	-1.0	 Der Regen tropft vom Dach.	wordlists_1correct
133	sub04	Die letztmalige Feststellung war eindrucksvoll.	-2.0	 die letzten	wordlists_1correct
134	sub04	Diese Mannschaft schoss gleich drei Tore.	1.0	 Diese Mannschaft schoss zwei Tore.	wordlists_1correct
135	sub04	Die Entscheidung darfst du selbst fällen.	-2.0	 Nicht verstanden.	wordlists_1correct
136	sub04	Vor der Hütte sitzt ein großer Heuhaufen.	-2.0	 Nicht verstanden.	wordlists_1correct
137	sub04	Die Rinder sind noch auf der Weide.	1.0	Die Rinder sind noch auf der Weide.	wordlists_1correct
138	sub04	Sie trägt ein Lächeln im Gesicht.	-2.0	Gesicht	wordlists_1correct
139	sub04	Die Nachbarn feiern gemeinsam im Garten.	1.0	 Die Nachbarn feiern gemeinsam im Garten.	wordlists_1correct
140	sub04	Es wird auch da chinesisch gesprochen.	10.0	 Es wird auch da Chinesisch gesprochen.	wordlists_1correct
141	sub04	Fünf Filmtitel müssen wir aufschreiben.	2.0	 Fünf müssen wir...	wordlists_1correct
142	sub04	Im Wald plätschert eine dunkle Quelle.	2.0	 Nicht verstanden.	wordlists_1correct
143	sub04	Stehend macht man seine Aussage.	10.0	 Stehend macht man seine Aussage.	wordlists_1correct
144	sub04	Der Bahnhof liegt sieben Minuten entfernt.	1.0	 ist zehn Minuten.	wordlists_1correct
145	sub04	Ein leiser Windhauch streift die Wiesen.	1.0	 Ein leiser Wind.	wordlists_1correct
146	sub04	Ein Schiff gleitet über das Wasser.	10.0	 Ein Schiff gleitet über das Wasser.	wordlists_1correct
147	sub04	Bei Konkurs kennt der Richter keine Gnade.	-2.0	 Bye, Frau.	wordlists_1correct
148	sub04	In ihrem Blick lag eine tiefe Sehnsucht.	1.0	 Sehnsucht.	wordlists_1correct
149	sub04	Seine Worte schwebten wie Schmetterlinge.	2.0	 seine Worte schwebten wie Schmetterlinge.	wordlists_1correct
150	sub04	Nach der harten Arbeit brauche ich Zerstreuung.	-2.0	 Nach der harten Arbeit brauchten sie	wordlists_1correct
151	sub04	Ein älteres Paar spaziert Hand in Hand.	10.0	 Ein älteres Paar spaziert Hand in Hand.	wordlists_1correct
152	sub04	Die Sonne strahlt am wolkenlosen Himmel.	2.0	 strahlt Wolke hoch am Himmel.	wordlists_1correct
153	sub04	Nach diesen Sturmböen herrscht ein furchtbares Chaos.	10.0	 Nach diesen Sturmböen herrscht ein furchtbares Chaos.	wordlists_1correct
154	sub04	In der Dämmerung kommen wir heim.	2.0	In der Dämmerung kommen wir heim.	wordlists_1correct
155	sub04	Mein Chef hat eine seltsame Frisur.	2.0	 Mein Chef hat eine seltsame Frisur.	wordlists_1correct
156	sub04	Die Straßenlaternen leuchten im Abendnebel.	-1.0	 Die Straßenlaternen leuchten im...	wordlists_1correct
157	sub04	Ein Bauer arbeitet auf seinem Acker.	1.0	 einarbeitet auf	wordlists_1correct
158	sub04	Nervöse Menschen brauchen viel Ruhe.	10.0	 Nervöse Menschen brauchen viel Ruhe.	wordlists_1correct
159	sub04	Ein Musiker verzaubert die Menschenmenge.	0.0	 ein verzaubert die Menschen.	wordlists_1correct
160	sub04	Auf dem Gehweg quietschen Kinderfahrräder.	0.0	 auf dem	wordlists_1correct
161	sub04	Der Regenbogen endete im Blumentopf.	2.0	 Der Regenbogen endete im Topf.	wordlists_1correct
162	sub04	Morgen umarmt der Nebel die Berge.	-2.0	 Der Morgen, Nebel, Berge.	wordlists_1correct
163	sub04	Der Pflug zieht tiefe Furchen.	2.0	 Der Pflug zieht tiefe Furchen.	wordlists_1correct
164	sub04	Du hilfst mir beim Fernstudium.	-1.0	 Hilfst mir beim	wordlists_1correct
165	sub04	Jeden Freitag gibt's frischen Fisch.	-1.0	 Jeden Freitag gibt's frischen Fisch.	wordlists_1correct
166	sub04	Vater mischt gleich die Karten.	10.0	 mischt gleich die Karten.	wordlists_1correct
167	sub04	Leise rollen wir aus dem Bahnhof.	2.0	 und leise rollen wir aus dem	wordlists_1correct
168	sub04	Der Kaffeeplausch wurde von Ameisen gestört.	-1.0	 Oderson.	wordlists_1correct
169	sub04	Montag war es uns zu regnerisch.	-1.0	 ist.	wordlists_1correct
170	sub04	Böse Menschen verdienen ihre Strafe.	2.0	 Böse Menschen verdienen eine.	wordlists_1correct
171	sub04	Motoren brauchen Benzin, Öl und Wasser.	1.0	 nicht verstanden.	wordlists_1correct
172	sub04	Die Tür knarrt laut beim Öffnen.	1.0	 nicht verstanden.	wordlists_1correct
173	sub04	Der Bus hupt vor der belebten Haltestelle.	2.0	 der Bus vor der Haltestelle	wordlists_1correct
174	sub04	Die Musik erklingt sanft im Raum.	10.0	 Die Musik erklingt sanft im Raum.	wordlists_1correct
175	sub04	Der Lehrer erklärt schwierige Konzepte.	-2.0	 Lehrer.	wordlists_1correct
176	sub04	Wir wollen heute spazieren gehen.	10.0	 Wir wollen heute spazieren gehen.	wordlists_1correct
177	sub04	Die Vögel zwitschern am Morgen.	1.0	 Vögel zwitschern am Morgen.	wordlists_1correct
178	sub04	Öfen brauchen Kohlen und Briketts.	2.0	 nicht verstanden.	wordlists_1correct
179	sub04	Wild pfeift der Wind durch die Wände.	-1.0	 Pfeift der Wind durch die Wellen.	wordlists_1correct
180	sub04	Die Bremse quietscht beim linkslastigen Bremsen.	0.0	 nicht verstanden.	wordlists_1correct
181	sub04	Der Arzt untersucht den Patienten.	10.0	 Der Arzt untersucht den Patienten.	wordlists_1correct
182	sub04	Er gewinnt sechs Spiele nacheinander.	-1.0	 nicht verstanden.	wordlists_1correct
183	sub04	Wenn der Schnee schmilzt, kommt der Frühling.	0.0	 Nicht verstanden.	wordlists_1correct
184	sub04	Diese Durchsage ist ohne Gewähr.	-1.0	 diese Durchsage ist.	wordlists_1correct
185	sub04	Opa jammert ständig über seine Asthmaanfälle.	2.0	 der meckert ständig über	wordlists_1correct
186	sub04	Ein älteres Ehepaar tanzt auf der Hochzeitsfeier.	2.0	 Ein älteres Ehepaar tanzt auf der Hochzeitsfeier.	wordlists_1correct
187	sub04	Der Raureif zaubert Diamanten auf Blätter.	10.0	 Der Rauralf zaubert Diamanten auf die Blätter.	wordlists_1correct
188	sub04	Die Blumen blühen bunt im Blumenkasten.	10.0	 Die Blumen blühen bunt im Blumenkasten.	wordlists_1correct
189	sub04	Die Uhr tickt ruhig an der Wand.	-2.0	 Die...	wordlists_1correct
190	sub04	Ihr Lachen hallte durch den leeren Park.	0.0	 der hallte durch die	wordlists_1correct
191	sub04	Manche Menschen vertragen keine Erdbeeren.	2.0	 Manche Menschen vertragen keine Erdbeeren.	wordlists_1correct
192	sub04	Gleich hier sind die Nahrungsmittel	-1.0	 nicht verstanden.	wordlists_1correct
193	sub04	Verkehrsampeln leuchten grün, gelb, rot.	10.0	 Verkehrsampeln leuchten grün-gelb-rot.	wordlists_1correct
194	sub04	Junge Erwachsene genießen das Stadtfest.	1.0	 Junge Erwachsene.	wordlists_1correct
195	sub04	Sie liest ein Buch in der Sonne.	0.0	 Sie liest ein Buch in der Sonne.	wordlists_1correct
196	sub04	Studenten treffen sich in der Bibliothek.	-1.0	 in der Bibliothek.	wordlists_1correct
197	sub04	Hier richten Zimmerleute ein Dach.	-2.0	 nicht verstreiten.	wordlists_1correct
198	sub04	Vater will sich eine Pfeife anzünden	0.0	 Vater will eine anzünden.	wordlists_1correct
199	sub04	Nicht alle Menschen verkraften den Linksverkehr sofort.	2.0	 Nicht alle Menschen verkraften.	wordlists_1correct
200	sub04	Prinzipiell müssen alle Hunde ein Halsband tragen.	0.0	 Prinzipiell müssten alle Hunde.	wordlists_1correct
201	sub04	Kinder spielen fröhlich im Park.	0.0	 Kinder spielen.	wordlists_1correct
202	sub04	Der gelbe Küchenofen sorgt für Wärme	2.0	 Küche, Ofen.	wordlists_1correct
203	sub04	Nicht jeder verträgt kaltes Bier.	-2.0	 nicht verstanden.	wordlists_1correct
204	sub04	Senioren machen morgendliche Gymnastik im Park.	10.0	 Senioren machen morgendliche Gymnastik im Park.	wordlists_1correct
205	sub04	Die Wolken malen Geschichten am Himmel.	1.0	 Nein.	wordlists_1correct
206	sub04	Das kalte Licht leuchtet am Morgen.	-1.0	 Das Kalte am Morgen	wordlists_1correct
207	sub04	Für Volkskunst schwärmt nicht jede Altersstufe.	-1.0	 der.	wordlists_1correct
208	sub04	Der Frosch sprang rein ins Täschchen.	2.0	 Der Frosch sprang rein ins Loch.	wordlists_1correct
209	sub04	Mein Arzt empfahl dringend Bäder.	1.0	 mein Arzt.	wordlists_1correct
210	sub04	Der Kaffee dampft in den Tassen.	1.0	 Der Kaffee dampft in Tassen.	wordlists_1correct
211	sub04	In der Galerie bewundern Besucher zeitgenössische Kunst.	-2.0	 In der Galerie wurde	wordlists_1correct
212	sub04	Die Katze schnurrt zufrieden auf dem Sofa.	1.0	 Die Katze schnurrt zufrieden auf dem Sofa.	wordlists_1correct
213	sub04	Ängstlich begreifst du Omas Lage.	1.0	 Ängstlich, du musst...	wordlists_1correct
214	sub04	Unsere Söhne lieben flotte Tänze.	0.0	Söhne lieben	wordlists_1correct
215	sub04	Der Kamin verbreitet wohlige Wärme.	2.0	 Der Kamin verbreitet wohlige Wärme.	wordlists_1correct
216	sub04	Beim Studienkurs musst Du ernsthaft lernen.	0.0	 Im Studienkurs ernsthaft lernen.	wordlists_1correct
217	sub04	Der Kellner jongliert mit den Speisekarten.	-2.0	 Der Kellner jongliert mit denen.	wordlists_1correct
218	sub04	Zum Ausweis gehört ein Lichtbild.	-2.0	 nicht verstanden.	wordlists_1correct
219	sub04	Die Freunde treffen sich am See.	2.0	 Freunde treffen sich zum	wordlists_1correct
220	sub04	Die Straßenlaterne spendet warmes Licht.	10.0	 Die Straßenlaterne spendet warmes Licht.	wordlists_1correct
221	sub04	Die Gärtnerin tanzt zwischen den Blumenbeeten.	-2.0	 Die Gärtnerin tanzt zwischen dem Blumenbeet.	wordlists_1correct
222	sub04	Die Kaffeetasse klirrt beim Frühstück.	-2.0	 Die Kaffeetasse klirrt auf.	wordlists_1correct
223	sub04	Der Regen klopft ans Fenster.	-1.0	 klopft ans Fenster.	wordlists_1correct
224	sub04	Der Nachbar sang unter der Dusche Oper.	2.0	 der Nachbar.	wordlists_1correct
225	sub04	Achtlos wirft der Knirps Matsch durchs Eckfenster.	10.0	 Achtlos wirft der Knirps Matsch durchs Fenster.	wordlists_1correct
226	sub04	Die Musiker unterhalten Passanten mit ihrer Musik.	1.0	 Die Musiker unterhalten sich.	wordlists_1correct
227	sub04	Wir haben ein Abteil extra für uns.	0.0	 Wir haben einen Expertenkurs.	wordlists_1correct
228	sub04	Schnupfen stört uns natürlich sehr.	1.0	 nicht verstanden.	wordlists_1correct
